review,label
价格 携程 店头 活动 价格 家 会员 价格 携程 低 携程 订单 一点 竞争力 房间 床太硬 电视 二楼 屋子 还算够 设施 陈旧 空调 作用 噪音 屋子里 干净 环境 吉林市 手机 市场 旁边 早上 商店 开业 一百多 分贝 喇叭 音乐 语 宣传 震死 态度 服务台 那位 小姐 当天 心情 不好 情绪 带到 工作 客人 态度 生硬 搭 不理 令 客人 心情 极差 朋友 房间 急于 地方 入住 位置 北齐 楼 侧面 外面 很难 出租车 司机 这家 店 满意,0
酒店 大堂 达 不到 四星 房间 达 不到 四星 标准 服务员 礼貌,0
本次 预定 帮 同事 酒店 感受 满意 第一 酒店 年 开业 实际上 年 手中 接 转过 哪一年 酒店 酒店设施 旧 入住 当天 预定 前台 沟通 差点 导致 客人 房间 携程 协助 解决 携程 预定 成功 酒店 留房 抽调 两个 房间 第三 入住 酒店 房间 情况 流出 水 脏风筒 坏 报修 久 携程 协助 搞定 风筒 第四 酒店 服务员 客人 态度 不好 房 洗手间 浴缸 客人 问 浴缸 房间 服务 人员 客人 第二天 早上 路过 房间 时 开着 门 房间 恰有 浴缸 明白 服务员 欺骗 客人 第五 早餐 时 餐厅 服务 人员 客人 签 早餐 账单 携程 调查 酒店 前台 服务 人员 电话 怀疑 属 前台 设置 房间 两张 房卡 销售部 经理 发生 事 感受 钱 客人 态度恶劣 客人 支付 能力 客人 逃单 员工 培训 到位 服务 北京 住 这家 酒店 推荐 朋友 同事 入住 这家 酒店 补充 点评 年月日 入住 退房 上述情况 耽误 时间 帮 客人 节约 时间,0
饭店 前台 预订 部 缺少 起码 沟通 信息 传递 很满 前台 态度 不好 电话 声音 很小 热情,0
前台 服务 太慢 前台 男生 态度 极差 极差 电梯 本来 两部 始终 维修 电梯 每层 停留 两次 坐 房间 卫生 不好 地面 好像 做 清洁 卫生间 干净 毛巾 好像 抹布 怪味 水杯 塑料 打电话 吹风机 插座 客人 前台 淋浴 喷头 漏水 打电话 告知 前台 派 保安 充当 维修工 房间 察看 锦江 之星 再也 不想 住,0
房间 陈旧 服务 差 设备 陈旧 垃圾 酒店,0
酒店 总体 感觉 太差 房间 脏旧 晚上 入住 用水 开 水 混水 铁锈 颜色 早餐 差 东西 吃 同级 家 相比 家差,0
锦江 质量 高性价比 西安 选择 锦江 之星 店 住 锦江 之星 最差 印象,0
因行 打烊 身上 已有 但家店 刷 外卡 想 先押 美金 前台 同意 真的 死 本要 押 行李 真不知道 押 美金 比押 行李 保障 能力 差 退房 前台 服人度 不佳 名 表 一貌 遭 民生 交通 算 补充 点评 年月日 Τ ┬ 丁 ず 楞楞,0
老家 亲戚 订 酒店 住 地方 总天 感觉 酒店 有个 免费 停车场 够 每次 停车,0
几年 锦江 之星 心目 中 位置 经济 酒店 中 第一位 跌到 第四 五位 更是 导致 再也不会 住 品牌 酒店 千里之堤 会崩于 蚁穴 蚁穴 之不察则 非 偶然 入住 行程 原因 早晨 退房 下午 回来 领取 行李 这件 非常简单 事情 胖 职员 却说 奥运会 警方 退房 时 行李 带走 问 酒店 职员 时 下午 六点 前 提取 行李 核实 服务 电话 电话 中 六点 前 回来 提取 咨询 胖 职员 改口说 安排 早上 退房 时 胖 职员 行李 带走 职员 说法 领会到 精神 无奈 之下 行李 带走 那天 上午 参加 三个 会议 穿插在 繁重 行李 搬运 之中 实在 苦不堪言 在此之前 杭州 品牌 经济 酒店 住宿 旅客 行李 寄存 数日 旅客 周边城市 游玩 昨天晚上 入住 上海 另一家 酒店 行李 照样 晚上 点前 提取 锦江 之星 六点 前提 走 本来 苛刻 胖 职员 所作所为 更是 太过分 问问 这位 胖 职员 全 中国 酒店 全 上海 酒店 包括 同事 领会到 精神 模式化 礼貌 表面 一颗 顾客 心 锦江 之星 僵化 表现 顾客 权力 锦江 之星 做 唯一 做 用脚 投票 永远 入住 锦江 之星,0
第一次 住 此类 酒店 感觉 招待所 做 整洁 装修,0
靠近 路边 房间 太吵 太吵 办法 睡觉 劝,0
上次 半夜 上海 请 携程 帮忙 订 这家 店 携程 服务 满意 这家 店 实在 不敢恭维 窗户 锁闭 空调 效果 不好 房间 潮湿 手机信号 携程 预定 员 事先 告诉 房间 协调 不是太好 算是 自作自受 选 希望 下次 住 补充 点评 年月日 听 前台 用语 规范 刷 预 授权 非 硬硬 句 先 冻结 四百,0
终于 锦江 之星 做 莫泰 态度 明明 收到 携程 短信 佃户 确认 晚上 前台 信息 搞了半天 入住 朋友 预定 名字 关键问题 一到 前台 先报 朋友 名字 朋友 身份证 搞 虚惊一场 做事 太 仔细 服务 总算 顺利 入住 马路 房间 吵 洗手间 毛巾 一条 脏 不行 客房 打扫 做 第二天 结帐 告诉 被子 脏 支付 清洗 费先 有没有 明码标价 纳闷 被子 原本 洗 大钱 做法 舒服 出差 大大小小 酒店 住 事情 第一次 说实话 情愿 多花钱 住 莫泰 住 锦江 之星,0
第二次 入住 客户 很近 图个 先说 第一次 入住 空调 不冷 搞 房间 桑拿房 归类 运气 略过 不计 网络 速度慢 只能 不可思议 形容 中国电信 宽频 服务 酒店 速度 拨号上网 还慢 算是 开 眼界 第二次 checkin 就让 酒店 住 第三次 前台 男员工 吊儿郎当 一副 爱理不理 腔调 问 三句话 勉强 回 几个 字 想 搞不好 老板 儿子 真 想不出 酒店 员工 原因 何在 早餐 烹饪 区 厨师 教育 躲来躲去 想下 一碗 面站 半天 硬是 不到 服务台 小姐 索性 装作 估计 希望 多一事不如少一事 房间 设备 倒 想 赶走 客人 轻而易举 事 办法 发现 管理 员工 酒店 管理 只能 贵 酒店 不想 做个 四星级 酒店 吹毛求疵 道歉 绝大多数 兢兢业业 员工 表示歉意,0
交通 没什么 车 隔音 很差 新开 同价位 选择 汉庭 莫泰 房间 感觉 像是 纸糊 浴室 太差,0
上菜 速度 奇慢 菜汤 半小时 差劲 上网 收费 不爽 免费 注册 网站 导航 宾馆 索引 服务 携程 诚聘 英才 代理 合作 广告业务 Copyrightctripcomallrightsreserved,0
位置 偏 黑漆漆 本地人 开车 找 好久 找到 房间 装修 差 几年 装修 住潭江 半岛 酒店 潭江 半岛 酒店 满意 出行 建议 住 假日酒店 假日酒店 鼎鼎有名 假日酒店 非洲 欧洲 区别,0
交通 这是 唯一 入住 理由 晚上 吵 选择 面对 火车站 房间 房间 价位 卫生间 很小 昏暗 凌晨 酒店 半价 房间 携程 便宜 酒店 服务 态度 行 早餐 块钱 进 餐厅 明明 入住 包括 早餐 火车 懒得 理论 早餐 差劲 住 千万别 吃,0
酒店 太 职业 精神 半天 不到 一辆 taxi 结帐 时 发票 客房 条件 性价比 太低 肯定 住 酒店 早餐 很差 周围环境 很差,0
服务 房间 条件 价格 竞争力,0
酒店 恼火 CTRIP 里查 价格 全适 入住 象是 宰割 冤大头 房间 电器 不好 可气 电话费 收费 比星 贵 月 号 入住 第二天 早就 走 几个 电话 收费 确是 详细 电话单 时 服务员 提供 一份 时间 记录 单子 电话号码 钱数 仔细 一看 气得 半死 打通 电话 收费 最让人 接受 携程 电话 收费 元分 这是 强盗 提出 找 经理 时 服务员 确说 经理 说话声 太大 原因 几个 男子 说不清 想干什么 赶时间 公司 出差 惹事 选择 付费 走 回到 公司 事情 携程 携程 无能为力 手上 酒店 电话 单子 事情 网友 上当受骗,0
打车 太 门口 分钟 早餐 品种 少 宽带 房间 空调 调 苏州 茉莉花 假日 下次 试试 补充 点评 年月日 接到 酒店 预订 部 电话 提 意见 跟踪 反馈 赞 日 入住 上海 华港 雅阁 酒店 虹桥机场 天壤之别 日 苏州 预订 一家 酒店 下次 苏州 我会 入住 友联 希望 真的 改进,0
前台 刷预 授权 交 押金 投诉 机会 最多 一张白纸 写 点 意见 估计 转身 丢进 垃圾桶 主楼 单间 商务 套房 临街 窗户 隔音 主干道 晚上 车水马龙 瞌睡 很能 睡 踏实 第二天 换 靠里面 标间 楼下 锅炉 空调 晚上 吵 第三天 换 商务楼 套房 家庭 楼房 装修 老房子 楼梯 住 打夜 麻将 晚上 楼梯间 大声 喧哗 隔音 更差 第四天 退房 出租车 问 司机 酒店 司机 耍 打牌 XXX 出差 商务 人员 住 感觉 不好,0
总体 比较满意 临街 窗户 隔音 效果 不好 酒店 价格 单间 合适 接近 酒店 装修 档次,0
最初 床间 临街 要命 窗户 坏 办法 隔音 换到 临街 豪华 标间 房间 味 住 晚上 早餐 另收 结账 时 前台 专业 发票 随手 搞 地上 一个劲 问 拿给 印象 差,0
到达 前台 刷卡 消费 采用 现金 押金 信用卡 结账 异地 取 现金 支付 手续费 不愿 多用 现金支付 房费 房间 拉开 桌子 抽屉 发现 两个 蟑螂 电话 通知 客房 中心 久等 连续 三次 电话 服务员 满不在乎 药 喷 天天 喷药 晚上 洗手间 发现 蟑螂 行李箱 蟑螂 服务员 留下 药 拼命 喷 第二天 早晨 穿鞋 蟑螂 清晨 电话 前台 换房 前台 解释 楼层 太低 蟑螂 餐厅 跑 客房 服务员 送 房间 房卡 前台 无奈 下楼 办手续 告知 先 结账 入住 无奈 结账 办理 入住 换至 楼层 感觉 稍 下午 发现 刚买 食物 蟑螂 恶心 通知 客房 中心 药喷忍 两天 退房 走 退房 时说 第一天 费用 入账 退还 第一天 房费 现金 押金 酒店 前台 拍 桌子 发了 一通 火 同意 刷卡 结付 费用 退还 现金 发誓 再也不会 酒店,0
工作 关系 位置 周围环境 房间 行 干净,0
身边 朋友 酒店 太 挑 真的 酒店 环境 本来 预订 几个 晚上 只住 晚上 换 地方,0
想到 住 宾馆 想 吐 第一 宾馆 热水 电热水器 洗 一半 热水 身上 肥皂沫 只能 毛巾 搽 掉 问 服务台 小时 电热水器 加热 时间 晕 房间 小强 晚上 岁 女儿 问 晚上 睡着 小强 咬 鼻子 建议 携程 赶紧 取消 这家 客栈 想 问 携程 推荐 酒店,0
服务态度 极差 见到 服务员 微笑 个个 板着脸 入住 时间 先交 天 押金 点 连续 几个 电话 催着 交 押金 前台 时 前台 摆着 脸 吵架 头 黑店 性质 三楼 桑拿房 黑店 奉劝 服务员 透露 回来 服务员 三楼 桑拿 承包 不归 酒店 黑人 骚扰电话 频繁 九点钟 电话 点 电话 干脆 不接 每隔 分钟 电话 骂 晚 骚扰 退房 时间 长点 分 退房 发票 搞了半天 发票 机器 坏 服务员 主动 客人 发票 互弄 下才 找到 IT 修理 天 点 分得 火车 点 发票 综合 分数 有分 分,0
酒店设施 旧 简单 只住 一晚 交通 倒 便利 房间 整体 感觉 脏 是因为 旧 原因 下次 换 一家 不想 住 没什么 值得 留恋 网线,0
环境 不太好 脏 服务,0
泰达 商务酒店 价格 吸引 房间 硬件 不错 洗手间 网速 比较慢 位置 城关区 周边 环境 太差 马路 卡车 铁路 火车 夜里 噪音 很大 很难 入睡,0
洒店 总体 规模较 入住 时房 卫生 做 解释 服务员 少 晚 七点 入住 入住 晚十点 多才 发现 网络 总台 解决 态度 不好 客人 事先 声明 网络 房间 调房 携程 调 一间 网络 房间 卫生间 下水道 装修 回味 补充 点评 年月日 网带 特慢 晚上 打开 几个 网页 网络 形同虚设 办 事,0
朋友 帖子 订 酒店 情况 地方 标间 免费 升 豪华 标准间 房间 不错 楼下 汽车 噪音 很大 感觉 兰州 素质 不行 没事 喇叭 早晨 吵 可气 早上 点 对面 单位 喇叭 广播 吵 门口 几个 服务生 服务 好像 站 酒店 位置 偏 出租 很难 分钟 大包 站 没人 帮 打车 服务 很差 入住 时 明明 说好 住 两天 押 押金 第二天 中午 回来 门 打不开 找 客房 中心 不理 告知 前台 生气 跑 前台 质问 前台 前台 小姐 白眼 一翻 不理 刷卡 面前 扔 问 早餐券 答 曰 下午 四点 送到 房间 入住 时间 搞错 早餐券 保证 答 曰 肯定 气 够呛 回 房间 投诉 转到 商务中心 真 明白 商务中心 功能 一通 胡扯 酒店 门禁系统 故障 反正 错 错 第二天 下午 电回 房间 找 早餐券 找 前台 告知 每人 答应 送到 房间 送券 服务员 前台 投诉 早餐券 送过来 理由 工作 忙 反正 错气 没话说 早餐 点 剩下 菜汤 房间 环境 很差 绿化 不好 太偏 难 打车 服务 太 差 年代 水平 象 不想 改进 宽带网 慢 补充 点评 年月日 荒凉 吃饭 打车 很远 可气 出租车 难,0
服务 实在 差临 退房 时如家 前台 非说 毛巾 干净 洗不掉 高额 罚款 办法 退回 房间 家 清洁 人员 面帮 毛巾 洗 干净 如家 工作人员 见状 工作人员 义务 洗 毛巾 洗衣房 洗 找 经理 经理 家 洗衣粉 义务 洗 干净 迹象 只能 客户 赔 晕死 客户 相比 如家 义务 洗 毛巾 包头 酒店 便宜 如家 不算 便宜 服务 差 下次 不住,0
服务态度 不好 走 有个 密封 纸 箱子 帮忙 先到 前台 结帐 找 帮忙 短短 十分钟 时间 查房 服务员 擅自 密封 纸 箱子 拆开 翻看 东西 帮忙 拿纸 箱子 门童 时 气愤 质问 服务员 服务员 振振有词 服 值钱 东西 拿走 幸好 资料,0
服务员 太 差 房间 吵 隔音 不好 房间 味道 很重 稀土 国际 大酒店 收费 低 四星 服务 火车站,0
感觉 一点 不好 房 事情 下午 四点 退 房间 收 房钱 前台 服务 不好 男 服务生 水平 希望 家 过问,0
办 锦江 之星 会员卡 相对来说 锦江 住 石家庄 锦江 住 平安大街 店 感觉 不错 是因为 平安大街 锦江 之星 商务 房 选择 住 如家 如家 外人 评价 挺不错 感受 感觉 失望 第一次 入住 如家 这家 酒店 使用率 太高 设施 陈旧 浴巾 边沿 磨烂 被子 感觉 洗 旧旧 周六 外出 游玩 回来 发现 浴室 梳子 更换 香皂 更换 黄色 牙刷 刷头 握 柄 黑黑的 东西 好脏 酒店 隔音 没想到 家 国大 店 隔音 差到 门口 塑料袋 摩擦 声 听 浴室 特别 唯一 比较满意 地方 工作人员 服务 不错 第二次 如家 太差 失望 对不起 价格 补充 点评 年月日 评价 代表 老公 意见 入住 时 情况 写 个案 感到 失望 真的 补充 一点 如家 前台 工作人员 穿 花 衬衫 确实 热带 风情 感觉 花哨 喜欢,0
国展 家 酒店 住 服务 环境 最差 酒店 住店 当晚 身上 不明 原因 红包 第二天 天津 皮肤病 医院 长征医院 一查 医生 确诊 床铺 不洁 螨虫 过敏 过分 这家 酒店 一位 男性 服务员 不经 客人 同意 房间 幸亏 洗澡 服务 不到 地方 提了 两条 真心 希望 天津 出差 旅游 朋友 住 这家 服务 素质 差 环境 差 酒店 受 罪 做 携程网 白金 会员 希望 携程 酒店 情况 酒店 拖累 携程 名声,0
位置 门口 修路 沙尘 滚滚 像样 食店 建议 入住,0
记得 月 日 入住 携程 预定 楼 商务 大床 楼 洗澡 设施 喷头 固定 不住 天 更换 房间 第一次 预定 携程 满意 终于 体验 预定 感觉,0
月 号 一间 大床 房 一楼 味道 很浓 走进 胡同 x 房有 窗子 很小 洗澡 拖鞋 一双 纸质 拖鞋 次 电话 前台 送 找到 前台 服务员 洗澡 拖鞋 房间 服务员 一双 纸质 拖鞋 留 洗澡 一家 三口 倒换 孩子 岁 桌子 提供 凳子 只能 做 床上 电脑 剩下 东西 吹风机 电熨斗 感觉 一早 走 永远 这家 酒店,0
提供 预定 房间 明明 两间 大床 房 当天 告知 标准间 冷气 坏 北京 度 高温 酒店 桑拿房,0
如家店 地址 偏僻 主干道 携程 帮 我订 一间 楼层 稍 高 房间 安静 一点 入住 一间 楼 真的 高 房间 电视机 没法 反正 预定 不让 满意,0
价位 不错 床太硬 酒店 餐厅 吃饭 不太 经济 行 酒店,0
不好 强烈建议 入住 没什么 服务 补充 点评 年月日 酒店 倒 发现 路面 坑坑洼洼 前台 漫不经心 信用卡 电梯 怀疑 货梯 绿色 滴 声音 大挺 吓人 客房 空调 酒店 服务员 中年男人 工作服 近一 小时 折腾 小时 制热 出风口 不到 度 吹 倒床 空调 一米 见方 处热 事 月份 住滴 实在 撑不住 床 客房 备用 中年男人 耷拉 脸 浴室 水 脸盆 淋浴 好像 患 前列腺 滴 半小时 热 刷 牙澡 没法 洗 吃 东西 滴,0
酒店 管理 专业 服务 差 房间 空调 冬天 被子 象 夏天 晚上 住宿 羽绒衣 防寒,0
后悔 不值 唯一 优点 交通 深 小巷 里 楼下 浴足 恶心 建议 取消,0
酒店 差 民宅 改建 设备 家具 不全 刷牙 杯子 破 电器 坏 晚上 前台 开着 门 睡觉 保证 早餐 花生米 油条 包子 稀饭 位置 高架 算 安静 吃饭 东西 特别 唯一 曲径通幽,0
家住 最差 酒店 携程 推荐 理由 工作人员 素质 差 房间 设备 质量 差 早餐 环境 闹市 自驾游 停车 选择 市区 较远 凯悦 下午 五点 宾馆 携程 网页 提供 信息 有误 前台 解决问题 诚意 前台 经理 途中 人间蒸发 不见踪影 不肯 主动 携程 取得联系 只能 携程 携程 工作人员 调查 时间 协调 妥协 入住 预定 房间 晚上 七点 实在 冷 饿 精力 坚持下去 大堂 空调 春节 寒冬 里 考验 毅力 我家 宾馆 晚餐 待遇 吃 一无所有 还好 隔壁 有迪欧 咖啡 这顿 晚餐 不错 回到 房间 晚上 九点 打算 洗澡 发现 淋浴 水龙头 坏 打开 水流 上下左右 n 方向 往上 水流 吊顶 吊顶 反射 回来 越过 玻璃 隔层 弄 卫生间 一塌糊涂 打电话 保修 隔 久 一会儿 替换 零件 一会儿 说修 不好 一度 换房 点 酒店 只能 提供 低一 档次 房间 点 总算 修好 打电话 客房 清扫 修理工 通知 客房部 部门 客房部 中班 人员 下班 打扫 只能 明天 早上 打电话 大堂 经理 投诉 宾馆 指南 里 写明 小时 值班 告知 大堂 经理 下班 打电话 前台 好话 坏话 总算 位 小姐 马马虎虎 弄 带个 孩子 加床 加 一床 被子 这是 地方 洗 睡 第二天 凌晨 累 无法形容 早餐 早上 九点 八点半 吃饭 强 字 大厅 人头 济济 乱哄哄 闹市 盆子 空 盆子 剩下 铺垫 菜叶 争先恐后 食品 地上 脏乱 不堪 杯子 碗 抢 几个 一次性 纸杯 六个 窝窝头 刮 一点点 粥 三个 茶叶蛋 三段 玉米棒 我家 年初 早餐 checkout 时 昨天 几位 前台 包括 那位 经理 人向 慰问 礼仪 招呼 宾馆 反馈 年月日 尊敬 客户 入住 当天 投诉 酒店 高度重视 限度 弥补 未能 平复 酒店 表示歉意 春节 期间 客情 异常 繁忙 一位 顾客 需求 职责所在 事后 酒店 投诉 相关 责任人 行政 感谢您 提出 宝贵意见 日后 管理 中 典型 案例 促使 服务 更趋 完善 酒店 殷切 期盼 光临 感受 服务 体现 尊贵,0
年月日 月 日 入住 绿色 标间 酒店 抱 高 期望 不到 两百元 价格 过高 希望 房间 干净 没想到 入住 失望 第一 安排 七楼 楼层 太高 水压 淋浴 热水 小得 可怜 洗着 洗 没水 第一天 服务台 承诺 说会 设法 解决 改变 第二天 洗澡时 很小 热水 五分钟 干脆 冷水 时间 接近 深秋 冷水 淋浴 滋味 实在 不爽 房间 打扫 速度 慢 明白 酒店 洗衣房 更换 床单 浴巾 中午 点 外面 送来 一早 出门时 挂牌 打扫 中午 第三 早餐 酒店 规格 早餐 质量 意料之中 早餐 种类 算 满意 供应 时间 夸张 点到点 点半 食物 冷 品种 齐全 稍微 晚起 几分钟 早餐 吃 第四 房间 电话 入住 三晚 每晚 自称 洗浴 中心 打电话 问 服务 酒店 管理 极差 达 不到 三星 标准 稍微 酒店 放 这类 电话 进 客房,0
住 天 受不了 好像 地毯 干净 床 干净 搬 圣地 香港 酒店 新点 凑合 反正 济宁 指望 酒店 终于 受不了 半夜 赶到 济南 住 CROWNEPLAZA,0
订 商务 大床 间 可惜 房间 可怜 床 写字台 之间 太紧 转身 无法忍受 房间 卫生间 异味 太重 投诉 解决方案 空气清新 开窗 通通 空气 哭笑不得 客人 气味 难闻 尴尬 房价 性价比 不值 早餐 不想 提了 强烈建议 入住,0
有幸 住 老板 想住 一点 以下几点 缺陷 请 朋友 住 酒店 刷 visa 卡 随行 老外 只好 买单 点 点餐 害 只好 外面 吃 垃圾 饭 服务 超级 差 明明 三楼 装修 安排 三楼 破破烂烂 贫民窟 老板 真的 难过 一家 酒店 携程 意见,0
走廊 里 地毯 污浊 房间内 设施 早晨 七点钟 热水 大床 房 包括 两个 早餐 服务员 告诉 只能 害 早饭 吃 一半 理论 改成 两份 早餐 遭遇 真的 郁闷 象是 政府 招待所,0
路边 吵 房子 结构 不合理 窗户 很小 贴近 地板 空调 重 味道 忍 房间 很小 实在 不想 住,0
优点 交通 中山北路 地铁站 步行 分钟 早餐 缺点 预定 特价 房 入住 时 安排 半露 楼 房间 大部分 露 外面 感觉 不太 安全卫生 入住 第三天 时 房间 门口 一只 死 蟑螂 房间 里 飞 苍蝇 换 房间 服务 不太 细致 不知 住 时间 长 几天 卫生间 用具 更换 新 宾馆 反馈 年月日 尊敬 嘉宾 您好 感谢您 选择 莫泰 共和 新路 旅店 真诚地 感谢 本店 客观 评价 意见 改进 提高 服务质量 动力 批评 本店 责成 相关 部门 整改 诚挚 歉意 本店 诚意 欢迎您 下次 选择 旅店 监督 检查 工作 本店 选择 房型 升级 谢谢 期待 入住 上海 莫泰 共和 新路 旅店,0
房间 隔音 效果 太 差 中午 入住 时 听到 楼层 赶活 声音 价格 早餐,0
蟑螂 具 可怕 解决问题 方法 想 送个 果盘 完事 态度恶劣 只能 拎包 走,0
房间 墙壁 房顶 漏水 发霉 起泡 脱落 位置 不太好 门口 消防队 南北 高架路 吵进 住 时 连锁 酒店 客人 推荐 酒店 会员 会员价 公司 协议价 低于 携程 价 结账 时 速度慢 晚到 前台 一个个 走 平均 需 分钟 我交 房卡 足足 分钟 算 结束 酒店 主动 出具 发票 问 服务员 开 开 一半 停下来 服务员 几个 客户 账单 对账 拖 时间 全国 城市 入住 莫泰 酒店 情况 连锁 酒店 失望,0
订 特价 房 关系 前台 态度 之差 冷嘲热讽 弄得好 像订 房 占 天大 便宜 情愿 干脆 取消 掉 弄 特价 房 本来 事情 态度 鄙视,0
帮 客户 订 担心 地段 最终 比较满意 特别 不好 地方 下次 追求 特价 房 换 莫泰好 点 地段 房间,0
客人 投诉 月 日 入住 房间 床上 小东西 咬人 咬 十多个 小红点 请 酒店 消毒 工作 做好 点,0
好处 虹桥 很近 赶早 飞机 不用 起太早,0
差得 要命 很大 股 霉味 勉强 住 一晚 第二天 早 赶紧 溜,0
位置 优势 房间 服务,0
感觉 不好 房间 霉味 设施 太过 陈旧 拧开 水龙头 久 热水,0
携城 预定 员 极力推荐 这家 酒店 入住 这家 酒店 发现 一星级 前台 小姐 穿着 衣服 慢不经 心地 回答 大堂 里 服务 部门 关着 门 商场 足浴 入住 好后 一进 房间 差点 两只 蚊子 夹功 冷 天 哪来 蚊子 奇怪 酒店 真有 本事 床单 没洗 脏得 要命 实在 看不下去 换房 晚上 总台 送 水果刀 汤勺 回复 这项 服务 晕倒 搞笑 原本 预定 时说 含 早餐 问 前台 早餐 退 二十块 钱 晕倒 服务 办不到 还开 酒店 酒店 太大 意见 携城 很大 意见 钻石 会员 推荐 酒店 客户 不可磨灭 坏 印象 这样的话 选择 贵司 预定,0
房间 整洁 空间 狭小 椅子 床 之间 太近 坐在 桌前 舒服 电视 吊挂式 只能 躺 床上 抬 头 建议 换成 壁挂式 液晶,0
酒店 上星 房间 临街 吵 房价 竞争力 旁边 新世界 酒店 前台 办理 入住 速度 慢 下午 酒店 休息 服务员 敲门 打扫 房间 不用 执意 换 毛巾 太 执着 唯一 算 不错 酒店 地址 商业区 高峰 打车 困难 下次 入住 携程 房间 价 一点 竞争力,0
入住 酒店 满意 经历 入住 第二天 早上 股市 开市 时 宽带 坏 请 网管 修理 光纤 坏 上网 电脑 大堂 无线 股票 晚 抛 半小时 盈利 缩水 想到 室内 游泳池 游泳 告知 游泳池 维修 开放 无奈 之下 只能 顶 烈日 外出 游览 中午 回 酒店 因太热 实在 胃口 中餐厅 想要 一碗 面吃 告知 点心 师傅 下班 只能 吃 炒菜 这家 炒菜 前一天 晚上 领教过 味道 极差 海鲜 里 泥沙 前一晚 海鲜 里 泥沙 换 菜 回到 房间 宽带 未 修好 一怒之下 找 大堂 经理 投诉 小时 未 修好 宽带 分钟 修好 想 问 几个 做 炒菜 饭店 会下 不出 一碗 面 找 理由 客人 吃 炒菜 说面 卖完 点心 师傅 下班 面 现 擀 宽带 长时间 修 不好 投诉 短时间 修好 忽悠 住客 表面 微笑 底下 冷漠 服务 五星级 差距 太大,0
客户 此家 酒店 服务 房间 星级 标准 服务 人员素质 不尽人意 令人 失望 网上 却排 推荐 第一 位置 请 情况 客人 推荐 一家 很差 酒店宾馆 反馈 年月日 酒店 非常重视 携程网 客人 评价 客人 提出 意见 改正 完善 发现 点评 中有 一位 客人 评价 很差 住宿 客人 潘先生 潘先生 酒店 住宿 期间 客房 服务 满意 点评 朋友 填写 华庭 时尚 商务酒店 真诚 各界 朋友 酒店 入住 希望 潘先生 朋友 机会 体验 努力 提供 热情 优质 服务,0
