review,label
携程 订 无烟 房 酒店 没法 满足要求 每次 享受 免费 升级 升级 套房 顺利 地订 房间 升级 升惯 失落 喜欢 喜欢 早餐,1
太原市 酒店 这家 算是 不错 住 房间 设施 满意 服务 没什么 太 感觉 入住 预订 过有 入住 前台 接待 小姐 热情 告诉 网络 订房 优惠 办法 帮 做 第二次 想 前台 网络 公司 订房 当班 前台 人员 拒绝 上次 事 电脑 查清 确实 那天 入住 过后 不为 办理 客人 撒谎 得知 大堂 经理 搞 生气 总去 住 影响 喜欢 万狮,1
酒店 评星 努力 提升 携程 价格 太高 朋友 预定 高出 近期 住 久 朋友 订 房间 价格 低 朋友,1
山西 万狮 京华 维景 国际 大酒店 服务 酒店 环境 下次 光顾 没错,1
酒店 位置 偏 还好 酒店 内部 设施 服务态度 值得 一试,1
感觉 该店 服务 凌晨 三点 客户 回来 不到 车请 帮忙 一辆 出租车 车 一位 大堂 副理 随车 接 女生 满意 早餐 爱 吃 黄桃,1
房间 卫生间 布局 不太 房间 面向 商场 开窗 空气 新鲜 早餐 退房 服务 不错,1
房间 不错 升级 服务 不错 提供 擦鞋 服务 下雪天 确实 值得 推荐 入住,1
酒店 五一 假期 降价 促销 感觉 不错,1
酒店 涨价 生意兴隆 酒店 实力,1
总体 不错 酒店 大堂 设在 商场 感觉 条件 尚可,1
环境 挺不错 工作人员 热情 晚上 保安 巡逻 发现 窗户 没关 电话 提醒 赞 早餐 略显 酒店 门口 峨眉 特色小吃 旅游 车站 线路 房间 设施 虽达 不到 四星 标准 景区 不错 推荐,1
太子 酒店 酒店风云 拍摄地 出差 东莞 入住 同事 兴奋 拍照 纪念 太子 酒店 偶住 酒店 喜欢 酒店 大堂 气派 壁上 大型 浮雕 装潢 精致 大气 房间 环境 设施 令人满意 打开 房门 插电 一刻 阳台 窗帘 徐徐 拉开 感觉 电视机 DVD 挑 浴缸 对面 屏幕 洗澡时 全程 电子 遥控 板 操纵 太 日常用品 不缺 意想不到 贴心 物品 赞 服务 房价 便宜 五星级 实在 值得 唯一 荒凉 只角 想要 Happy 酒店 里 补充 点评 年月日 住 园 景房 失望 各类 设备 标间 园景 酒店 花园 标间 性价比 更值,1
酒店服 不所 浴室 最正 自助 早餐 富免 享用 泳池 健身 室 酒店 位置 欠佳 建 於 工什行 街 地方 坐 酒店 常平 火站 市行 街 酒店 提供 交通 指示 坐 什到 什 地方 更好 每人 坐 天 白牌,1
酒店 硬件 服务 浴室 内装 墙上 电视 更是 首次 见到 酒店 地理位置 不太好 东莞 工厂区 沙尘 滚滚 特别 旅游景点 酒店 所属 地区 黄江镇 常平 火车站 常平 市区 打车 谈价 十五分钟 路程 开价 四五十元 酒店 提供 免费 专车 往返 常平 火车站 小时 一斑 旅客 请 提前 致电 酒店 发车 时间表,1
酒店设施 创新 使用者 着想 窗帘 自动开关 不太好 控制 灯 电视 空调 按钮 放在 外置 开关 晚上 按钮 毛巾 太薄 吸水性 低 早餐 不错 前台 人员 表现 还好 补充 点评 年月日 神州行 kanghsi 评点 交通 出入 出租车 东莞 出租车 最黑 几十 黑车 价格 标准间 人民币 符合 星 价格 酒店 消费 酒店 装修 新 酒店 装修 风格 颜色 符合 星 酒店设施 按摩 健身 游泳池 KTV 餐厅 餐厅 不错 演艺 厅 不错 算是 酒店 特别之处 加 分 房间 用具 毛巾 厚 吸水性 枕头 被子 床 算 房间 设施 DVD 机加分 房间 电器 按钮 不好 洗手间 设施 洗澡水 大大的 可怕 淋浴 浴缸 房间 电视 房间 隔音 隔音 洗手间 水压 太 大会 吵 房间 空间 面积 平米 符合标准 上网 条件 上网 速度 早餐 水平 种类 味道 前台 服务 服务员 水平 主动 门童 服务 出入 下车 主动 开门,1
房间 设施 不错 房间内 插座 我用 电脑 手机 充电 奇怪 服务员 拿排 插,1
房间 设施 豪华 房 浴缸 上方 镶 墙 电视,1
自动 窗帘 窗纱 遥控 开关 台 太子 酒店 独特 地方 演艺 馆 特色 专业 歌舞 杂技演员 留下 深刻 印象 早餐 精致 大锅饭 感觉 园 景房 窗外 景色 不错 超大 泳池 园林 儿童乐园 朋友 跑 园子 里 摘 荔枝,1
房间 设施 先进 自动化 程度 高 喜欢 演艺 馆 演出 场 水平 真 不错 号称 歌舞 演员 太子 正式 员工 打卡 上班 杂技 精彩 几个 世界 大奖 节目 建议 东莞 出差 朋友 放过 机会 演艺 馆 最具 特色 别忘了 提前 预订 座位 前排 最低 消费 高 人才 块钱 晚上 点 点 很值,1
酒店 位置 服务 不错 房间 设施 陈旧 九州 港 交通 适合 一家人 度假 时 入住,1
三人房 商务 套房 不错 房间 很大 适合 一家人 住 厨房设备 齐全 洗衣机 补充 点评 年月日 房间 设施 用品 星 水平,1
酒店 环境 房间 环境 设施 早餐 实在 不敢恭维 招待所 希望 改进,1
住 国内外 酒店 百家 珠海 住 好几家 大小 国庆节 入住 这家 挂牌 四星 公寓 酒店 豪华 三人 套现 分享 酒店 几座 商品房 改造 外部环境 不错 绿树成荫 房间 面积 房一厅 酒店 康乐活动 保龄球 高尔夫球 练习场 网球 游泳 须 收费 酒店 停车 收费 客房 食品 价格 不高 服务态度 服务员 会带 客人 房间 介绍 房间 设施 入住 退房 不好 设施 豪华 只能 算 舒适 客房 厨房 加元 客房 毛巾 清洁 专业 床 床上用品 质量 客房 保养 做 睡房 床头灯 调节 光度 小孩 睡房 窗户 打开 小心 窗户 距床 小孩子 床上 玩 酒店 提示 窗户 做成 只能 打开 厘米 补充 点评 年月日 酒店 硬件 最多星 水平 好处 周边环境,1
酒店 地理位置 尚可 情侣 路 找到 三人房 典型 房 厅 房间 偏小厅 不错 设施 电视频道 HBOBBC 成人 电影台 人房 价格 优势,1
房间 整整 房厅 家 一家人 住 非常高兴 下回 住,1
优点 房间 很大 前台 酒店 南油 员工 宿舍 改建 感觉 像是 度假村 缺点 酒店 商家 事先 买好 东西 水 食品 前往 酒店 酒店 泳池 保龄球 高尔夫 健身房 网球 休闲 设施 签 协议 住客 免费 补充 点评 年月日 谢谢 酒店 回复 评价 记得 前台 结帐 时 服务员 提到 酒店 特别 重视 房客 反馈 由此看来 所言 不假 用心 酒店 生意 昌隆 宾馆 反馈 年月日 致以 诚挚 歉意 准确 信息 澄清 珠海 南油 大酒店 前身 珠海市 政府 投入 南海 石油 开发 外国专家 高级 公寓 国际化 理念 设计规划 直至 南海 石油 珠海 片 开发 项目 搁置 平衡 多方 利益 改建 渡假村 酒店 酒店 商场 营业时间 AM ― PM 地点 酒店 大堂 盏 记 食府 楼 酒店 咖啡厅 营业 住客 提供 便利 服务 本月 新 开张 一家 好思家 零食 店 酒店 泳池 保龄球 高尔夫 健身房 网球 休闲 设施 酒店 住客 享受 优惠 折扣,1
住宿 环境 不错 干净 前台 服务态度 小伙子 想 k 歌 房间 告诉 吃饭 说起 吃饭 建议 酒店 餐厅 吃 外面 美食街 贵 切身感受 自驾 想不通 开车 住店 收 停车费 太 道理 想 钱 想 疯 感觉,1
酒店 房间 旧 进门 有股 味道 墙上 显得 较脏 窗户 纱窗 酒店 服务员 提醒 开窗 蚊子 早餐 流 花厅 用餐 粤式 早茶 型 旅行社 团组 用餐 候时 长本 酒店 旅行社 签 协议 办理 入住 正好 赶上 旅行团 到达 办理 入住 前台 人员 忙乱 影响 入住 酒店 外部环境 早上 漫步 园内,1
酒店 不太好 找 GPS 找 不到 感觉 酒店设备 旧 安静 服务员 服务态度 尚可 住,1
安静 隔音 不好 早上 旅客 退房 吵 房间 设施 陈旧 平日 入住 性价比 算 韶关 酒店 携程 提供 太少,1
不知 幸运 拿到 房间 电话 线路 钥匙卡 插 不进 那孔 搞 梳子 插进去 取电 泳池 羽毛球场 设施 保养 更新 会议 停车场 满位,1
环境 不错 卫生 整栋 楼 服务员 毛巾 挺旧 换,1
价格便宜 环境 幽雅 餐厅 跟不上 服务态度 房间 配置 达,1
酒店 位置 交通 临街 噪音 窗户 隔音 效果 不如人意 浴室 中 配备 冲浪 浴缸 房间 中 桑拿房 酒店 自助 早餐 品种 口味 遗憾,1
差 字 房间 隔音 差 马路上 声音 声声 入耳 宽带 拨号上网 打开 网页 半天 收 邮件 整整 收 小时 收下来 跟前 台 办法 解决,1
不错 门口 大堂 成天 美女如云,1
天 提供 空,1
温泉 不错 卫生间 小且 旧 景区 宾馆,1
酒店 房间 不错 宽敞 背靠 音乐学院 安静 美女 出入 缺点 此楼 商务 用房 公司 里头 住 学生 高峰 期间 电梯 繁忙 半天 不到 晚上 骚扰电话 网速 比较慢 吃饭 消费 酒吧,1
茂名 酒店 拆 浴盆 帘子 长度 水溅 地面 滑,1
这是 第二次 入住 酒店 感觉 酒店 总体 服务生 档次 层次 不齐 礼貌 房间 冰箱 遗憾 地方,1
前台 服务 不好 结账 时 很慢 住 天 退房 延长 不行 酒店 楼 楼 茶餐厅 不错 服务员 服务 意识 有待 提高 见面 微笑 洗手间 客人 先 洗手 网速 较慢,1
确实 茂名 酒店 房间 很大 装修 新 酒店 处 位置 风景 窗户 隔音 马路 房间 晚上 睡觉 安静 早餐,1
各个方面 不错 接受 渣打银行 信用卡 接受 招行 信用卡 预 授权 只好 朋友 先 代劳 退房 时 招行 信用卡 付帐 感觉 怪怪的,1
不错 宽带 速度 不错 周边环境 喜欢,1
交通 对面 国美 电器 出入 车辆 处于 路口 混乱 楼 喝晚 茶 估计 大堂 进出 显得 嘈杂 电梯 配置,1
不错 住 出行 网上 预定 送 早餐 划算,1
服务 窗 路边 吵 舒服 卫生间 淋浴 太 习惯,1
元旦 前住 川妹子 服 意识 很强 细心 问一答 二三 想 客人 超前 房间 陈旧 洗澡 空 OK 泉泡 憾 泡 朋友 不错 捏 脚 技 喜,1
去年 月 北京 前 门店 房间 订 菜市口 不错 干净 服务态度 有问必答 餐厅 总体 楼下 涮 肉 不错,1
房间 干净 服务员 热情 值得一提的是 餐厅 便宜 实在,1
入住 每次 北京 首选 地方 习惯 如家 感觉 房间 越 住 越 宽 热水 依然 充足 热量 水量 十足 习惯 北京城 出门 两边 好吃 马路 左手 斜对面 新开 一家 小时 拉面馆 凌晨 睡不着 饿 再也 无需 找 出租车 满城 乱 钻,1
景观 房 给出 房间 没什么 景观 两间 懒 找 前台 理论 下次 住 定标 房 酒店 服务,1
环境 适合 渡假 软硬件 设施 不错 房价 高 房间 干净 明亮 早餐 比差 点 鼓浪屿 酒店 服务 环境 算是 不错,1
每次 住 感觉 不错 蚊子 打扰 建议 房间 灭蚊,1
环境 适合 渡假 软硬件 设施 不错 住 套房 房假 早餐 四星 比差 点 下次 厦门 回 住,1
海上 花园酒店 紧邻 菽庄花园 商业街 龙头 路 不远 位置 傍晚 岛 乘坐 酒店 免费 接送 游客 电瓶车 环岛路 绕行 鼓浪屿 一周 迎着 海风 岛上 景致 惊鸿一瞥 锦缎 蓝色 海面 好似 温柔 怀抱 令 夕阳 一点一点 沉睡 海上 花园酒店 标间 正 宽大 平台 推门 美丽 院景 无边 海景 每晚 鼓浪屿 音乐厅 欣赏 免费 音乐 演出 月色 如水 寂静 小巷 回到 灯火阑珊 海上 花园酒店 温暖 闲逸 度假 生活 令人 满心欢喜,1
酒店 环境 不错 自助 早餐 品种 值得 一去,1
环境 酒店 工作日 关系人 山上 走 分钟 水库 幽静 酒店 房间 很大 住 标 C 房 晚上 睡觉 关窗 开 空调 吵 温泉 住店 温泉 元人 房间 里 温泉水 木桶 泡 酒店 提供 一次性 塑料袋 周到 酒店 吃 一顿 晚饭 感觉 上海 价格,1
房间 干净 服务 宽带 上网 速度 很快 商务旅行 理想 选择 走廊 一头 开着 大门 透进 很大 风 门外 装修 杂乱 门内 环境 差距 较大 希望 改进 宾馆 反馈 年月日 您好 感谢您 大连 银帆 宾馆 中肯 评价 近期 大连 银帆 宾馆 主楼 装修 改造 工作 所指 康体 俱乐部 大楼 短期 工程 现将 整修 感谢您 银帆 装修 期间 一如既往 支持,1
国际 五星级 酒店 情侣 档 专业 酒店 评价 TT 先提 一句 本来 订 峨眉山 大酒店 是从 峨眉山 天颐 温泉 度假 大饭店 逃 酒店 地理位置 分 峨眉山 山脚 旁离 客运 中心 米 赞 地理位置 峨眉山 冰天雪地 热水澡 值得 推荐 酒店 环境 分满 标准 星级 酒店 酒店 里 远眺 峨眉山 酒店 环境 不错 酒店客房 分 酒店设施 稍 陈旧 开业 很久 总体 算 不错 酒店 服务 分 进门 有人 拉门 前台 态度 不错 办 checkout 信用卡 预 授权 撤销 做成 消费 取消 导致 成功 基本功 培训 免费 早餐 分 宴会厅 内用 早餐 总体 比天 颐要 表现 中规中矩 四星级 酒店 酒店 稍嫌 陈旧 一点 酒店 标准间 大床 房上 体现 价格 相比 性价比 不错,1
房间 温泉 团队 客人 实在 太多 池子 象 馄饨 吵吵闹闹 不象 享受 下午 问人 晚上 人多 第二天 开门 半小时 象 老式 公共 浴室 人满为患 团队 巴士,1
住标 c 住 康乐 中心 那头 泵房 太吵 估计 专 留给 携程 入住 时说 楼 噪音 观察 就楼 面对 泵房 几间 吵,1
标房 房间 挺大 外面 环境 我订 时 环球 好点 外面 没什么 估计 农村 农村 里 空气 价格 偏高 服务员 态度 不错 餐厅 上菜 速度 太慢 催 几次 上菜 地方 偏 四星级 酒店 远不如 地方 四星级 各项 服务,1
群山环绕 之中 温泉 酒店 空气 水质 没话说 酒店 服务 细节 到位 公共交通 直达 自驾车 路边 私车 送达 适合 度假 地方 长住 打折,1
楼 标准间 房间 很大 床 舒服 隔音 不错 空调 足够 暖 卫生间 棒 浴缸 木桶 泡 半个 小时 舒服 温泉 性价比 不高 池子 少 游泳池 水 太冷 倒 室外 那天 正好 下着雪 感觉 早餐 倒 一楼 中餐厅 东西 不错 价格 贵 味道 好量 足,1
我订 标间 B 房间 楼 房间 浴室 浴缸 木桶 房间 木桶 房间 只能 算 干净 温泉 房价 偏贵 酒店 客人 温泉 票元 只能 出入 不合理 温泉 总共 池子 室内 个个 土耳其 鱼池 室内 泳池 花瓣 池个 中药 池个 茶池 室外 池 温泉 设施 南京 颐尚 武义 落后 温泉 水质 感觉 不错 室外,1
酒店 报国寺 车站 房间 整洁 干净 瑜珈 温泉 峨眉 四大 温泉 住店 客人 需元人 性价比 高 早餐 唯一 缺点 号楼 楼道 比较复杂 象个 迷宫 找 房间 花 一点 时间,1
酒店 算 设施 旧 四星级 勉强 地处 陈家坪 大型商场 超市 背后 有个 美食街 送餐 服务 西餐厅 套餐 价格 另有 赠送 水果 小盘 不错 买不到 水果 开通 电话 要元 日 包打 市内 长途 看不懂 碰上 长途电话 煲会 上网 免费 网速,1
房间 内部 电视 太 陈旧 紧靠 马路 吵人 玻璃 双层 吃饭 背后 一条街,1
条件 服务 不错 房间 隔音 效果 太差 隔壁 开灯 关灯 听 浴室 水 太小,1
地理位置 家乐福 太平洋 购物中心 房间 不错,1
酒店 位置 购物 房间 算 干净 毛巾被 单稍 旧 晚上 房间 暖风 季节 冷,1
位置 不错 酒店 价格 不算 便宜,1
房间 隔音 感觉 地理位置 不错 江边 靠江 房间 开穿 远眺 大佛 服务态度 餐厅 前台 早餐 品种 少 点,1
成都 住 酒店 行政 房 不错 房间 里 设施 老旧 出门 打车 修 地铁 门口 改了 单行道,1
酒店 位置 偏僻 东莞 候机厅 分钟 路程 酒店设施 环境 不错 房间 够 设施 感觉 舒服 配套 餐厅 服务 菜 味道 不错 缺点 携程 预定 房间 位置 很差 无烟 楼层 房间 安排 楼 听到 楼 夜总会 鬼哭狼嚎 深夜 实在 气愤 更有甚者 两次 服务 人员 提供 擦鞋 服务 感觉 很差 本来 想 投诉 实在 太忙 门童 出租车 明目张胆 小费 加进去 综合 评离 五星级 补充 点评 年月日 楼下 点评 补充 餐厅 菜 贵 点 地址 偏 出入 没车 适合 商务 客 居住 掏腰包 建议 住 携程 定房 前台 力争 高层 房间 越高越 游泳池 确实 很漂亮 喜欢 游泳 错过,1
我订 高级 江景 房 三层 说实话 真的 没什么 江景 下午 大雨 阳台 上全 水 那天 三层 开会 三层 很浓 烟味 晚上 有人 大声 吼 卡拉 OK 房间 隔音 身 卡拉 OK 中 叮叮 铛铛 装修 打电话 前台 肯定 装修 卡拉 OK 打电话 声音 一点 二十分钟 两种 声音 如故 打电话 大堂 经理 房间 查看 半小时 人影 电话 装修 肯定 停 OK 小点声 只好 祈祷 中国 消费者 弱者 酒店 交通 出租车 公交车,1
酒店 环境 不错 饭店 贵 稍稍 消费 左右江 景房 视野 开阔 很漂亮 室外 泳池 有个 池 很大 干净 后悔 泳裤,1
酒店 选址 宝安 出差 不错 选择 下次 还会 入住,1
酒店 干净 漂亮 特别 赠送 洁具 木梳 贴心 最烦 每次 深圳 出差 飞机 出租车 司机 大肆 宰人 十几分 车程 要价 二百多块 打票 真叫人 吃不消 风气 估计 改不了,1
地点 路标 难 找 房间 够 窗外 时 视野 宽 设施 齐全 包括 消费 私人 用品 价格 高 点 用餐 品种 自助餐 质量 高 改进 服务 到位 入住 退房 办理 速度 很快 电话 接线生 态度 超好 打到 房间 电话 先 确认 客人 姓名 免除 骚扰电话 安全感 机场 路 顺畅 出门 不到 的士 郁闷 总体 不错 第二次 入住 希望 第三次 第四次 N 次 深圳 买房 算了 CCCCCCCCCC,1
挺不错 酒店 太难 找 司机 转 转 找 不到 入口 标示 建议 找 出租 一点 健身房 设备 有限,1
房间 干净 用具 设施 新 价格 宝安 工作 首选 美中不足 打车 困难 酒店 位置 理想 缘故,1
宝晖 酒店 机场 不用 罗湖 一带 找 酒店 酒店 大堂 餐厅 装璜 漂亮 特色 古雅 服务 人员 不错 热情周到 没什么 挑剔 内在 客房 设施 满意 住 行政 房间 写字台 插座 宽带 只好 电视机 柜 挪开 电脑 充电 真 设备 缺 冰箱 箱包 架 发现 藏 衣柜 里 面巾纸 盒 咖啡 一点 人性化 离开 房间 拔掉 房卡 房间 断电 漆黑 一团 CheckOut 拖 包小包 更是 酒店 拔掉 房卡 秒 一分钟 延迟 断电 建议 借鉴,1
酒店 服务态度 入住 时有 大型 会议 房间 骚扰电话 靠近 江边 步行 十分钟 即可 吃 有名 三江 鱼 坨 坨 鱼 西坝 豆腐 特色菜 下次 住 打车 司机 无人不知 酒店,1
住 宝晖 还好 外面 烧烤 档贵 离谱,1
环境 不错 设施 齐全 菜肴 美味 价格 适中 不错 强烈推荐,1
房间 布局 奇怪 空调 调节 装置 minibar 第一晚 找到 冻 一宿 入住 层 装修 油漆味 浓 大堂 味道 还好 旁边 中餐厅 油漆味 层 游泳池 风景 不错 正对着 创业 立交 第一晚 水果 夜里 十一点半 打电话 问 送进来 奇怪 深圳 关外 打车,1
周围环境 差 酒店 大堂 气派 房间 宽敞 设备 新 服务到位 总体 酒店 确实 五星 标准 周边环境 携程 费用 补充 点评 年月日 携程 房间 宽带 免费 提醒 手机 上网卡 磨 半天 一点 郁闷,1
整体 一家 中规中矩 四星级 香洲 酒店 算是 优点 缺点 反正 香洲 肯定 会住 酒店,1
房间 干净 周围环境 不错 理想 商务酒店,1
进房 第一 感觉 窗户 很大 视野 宽阔 仿佛 挂 幅 画 墙上 设施 齐全 遗憾 房里 大灯 另有,1
酒店 房间 景色 不错 酒店 早餐 不好 管理 太 专业 是从 酒店 外面 交通 外面 出租车 漫天要价 随便 拒载 车 住,1
不错 大堂 豪华 太 豪华 房间 很大 卫生间 早餐 差 一点 菜 多一点 早餐,1
管理 依然 硬件 虽好 陈旧 优势 价格 可别 丢,1
总体 不错 窗外 江 吃 乐山 友好 当心 敲诈 吃 东西 走 几家 问问 价 标间 房间 空间 很大 成就 算 对得起 价格 早餐 吃 送 两瓶 矿泉水 喝 建议 换 桶装,1
携程 浪漫 情人 夜 度假 产品 月 日 中午 点 入住 蜜月 套房 中午 点分 到达 酒店 办理 入住 手续 告知 房间 未 搞 卫生 小时 问 前台 接待 留电话 搞好 卫生 通知 一声 冷淡 回答 小时 自已 问 办法 只好 西餐厅 苦苦 等待 点分 前台 询问 一位 接待 感到 奇怪 没能 入住 打电话 问后 答复 分钟 搞好 点分 终于 入住 房间 感到 热 打开 空调 调到度 冲个 凉 休息 睡 一会 感到 房间 热一看 空调 调节器 度 显示 屋内 温度 度 打电话 管家 部 答应 工程师 分钟 工程师 一句 不好意思 中央空调 设定 温度 是度 晚上 就会 好点 真 难受 五星级 酒店 晚上 上半夜 温度 是度 早上 点钟 度 想象 月 日 夏至 最热 日子 住 五星级 宾馆 钱 受罪 酒店 大堂 豪华 西餐厅 套餐 不错 前台 接待 酒店 省电所 设定 温度 真的 太 差劲 原定 第二天 入住 豪华 客房 只能 取消 赳 离开,1
帮 朋友 订 豪华 大床 房 没想到 免费 升级 套房 间 套房 美死 酒店 硬件 设施 超赞 体验 体验,1
老公 订 蜜月 套餐 渡假 类产品 酒店 很大 气 感觉 西餐 不贵 情侣 套餐 好多 东东 一百五十 八元 一份 房间 气氛 值得 试试 下午 到达 游泳 吃饭 西餐厅 里 听歌 感觉 浪漫 按摩 一系列 套餐 里 感觉 不错 用餐 迎宾 态度 不太好 满意,1
性价比 大堂 装修 富丽堂皇 房间 豪华 配套 完善,1
酒店 不错 环境 安静 大堂 气派 订 青春 套房 房间 很大 舒服 酒店 西餐 不错 服务费 高 加收 午餐 点 一份 肉酱 烩 意粉 葡国 鸡 套餐 一共 不到 加 服务费 酒店 驾回 深圳 香蜜湖 花 小时 路上 不堵车 水寨 还会 选择 这家 酒店,1
安静 地段 不错 晚上 十一点 入住 用餐 时间 已过 服务员 主动 帮 外面 夜宵 非常感谢,1
住 副 楼 未 评星 设施 肯定 主楼 电视 收看 频道 不好 早餐 主楼 吃 早餐 不错,1
地理位置 不错 设施 商圈 热闹 酒店 旧 改造 服务态度 不错,1
住 附楼 未挂星 硬件 设施 陈旧 空调 不太好 换 回 房间 二楼 蚊子 服务,1
宜昌 算是 不错 酒店 大堂 很漂亮 房间 ok 将来 三峡 不错 选择 携程 价格 没什么 优势 朋友 公司 代定 房间 携程 价格 相比 差 一百块,1
住 大床 房 房间 很大 舒服 沙发 宾馆 设施 陈旧 木头 油漆 剥落 服务 同意 朋友 评价 房间 大佛 天文 望远镜 也许 行,1
宜昌 排名 前三位 酒店 希望 宜昌 首选,1
外观 起眼 房间 很大 干净 服务 不错 早餐 喜欢,1
环境优美 设施 齐全 服务周到 房间 舒适,1
员工 服务 房间 舒适 家 硬件 设施 应有尽有,1
宜昌 酒店 半岛 新 房间 尚 干净 设备 齐全 地理位置 偏外 不错 洗衣 服务 不行 下午 点 服务 改进,1
酒店 挂 住 豪标 优点 酒店 环境 尚可 房间 缺点 景区 分钟 路程 位置 不佳 想要 古镇 夜景 建议 住,1
服务员 诚信 收 订金 多付 服务员 电话 房间 告知 诚信,1
入住 豪华 标准间 房间 号 区 房间 干净 设备 遗憾 处 距离 古镇 约 分钟 路程 晚上 KTV 声音 吵 早餐 品种 口味 欠佳 补充 点评 年月日 酒店 距离 古镇 远 出行 古镇 坐 人力车,1
月 日 入住 总体 感觉 景区 远 正好 西塘 政治 中心 一路 走到 老镇 感受 岁月 变化 算 与时俱进 热 服务员 提供 电扇 美的 牌,1
参加 展会 首选 机场 坐 磁悬浮 龙阳 站 往前走 米 记得 年 参加 展会 时 龙阳 站 下车 没人 拉 原因 拉 不知 绕 地方 绕 回来 司机 感觉 一个样,1
房间 算 整齐 宽敞 住 标准间 大床 房 浴室 淋浴 笼头 不太好 出水 均匀 洗澡 舒服 服务 不错 酒店 早上 点 提前 入住 结账 速度 耽误时间 酒店 靠近 号 地铁 算,1
新 国际展览中心 没什么 优势,1
物有所值 环境 下次 浦东 机场 入住,1
天黑 时太难 找 亮灯 指示牌 打车 兜 一圈 找到 新 国际展览中心 那条 路 服务 行 太难 找,1
参展 选择 酒店 酒店 新 国际 展览馆 优势 摆展 走 回 酒店 免去 交通 麻烦 大型 展览会 酒店 价格 高 平时 房间 展会 时竟 涨 说实话 龙阳路 房间 不值 而来 早餐 一份 真不知道 好吃 点 估计 煎蛋 最让人 不爽 上网 收钱 还元 住 参展 商务 出差 带有 笔记本 办公 等于 变相 收元 房费 酒店 菜馆 东西 价格 倒 便宜 清炒 时蔬 块 总体 房间 算 干净 卫生 不值 价吧 摆展 入住 实在 比邻 计较 值得 推荐,1
不错 酒店 地理位置 不错 性价比 高,1
地处 市中心 周围环境 房间 总体 符合 四星级 标准 卫生间 条件 房间 电源插头 太少 找到 空着 只好 拔 落地灯 电源 笔记本 充电 床铺 舒服 感觉 床单 更换 洗得 太薄 本色 电梯 一部 地下 停车场 时间 较长 早餐 不提也罢 总体 如能 改进 下次 还会来,1
总体 感觉 不错 对得起 价格 隔间 太 差 晚上 旁边 房间 看电视 声音 听得,1
携程 评价 酒店 没什么 好感 早餐 很烂 期望值 本来 低 缘故 住 不错 房间 窗外 面对 摩天轮 体育馆 晚上 view 早餐 想象 西餐 类 烤面包机 不好 服务生 主动 出门 主动 询问 帮忙 出租车 长沙 出租车 良莠不齐 小心 太 和谐 客户 欧洲人 下榻 酒店 欧洲 同事 酒店 预订 接机 服务 接好机 酒店 安排 接机 人员 问 收 客户 懂 中文 酒店 无人 交流 酒店 懂 英文 只能 付 酒店 协商 退还 车费 酒店 态度 酒店 员工 乱宰 外国人 遗憾,1
上网 速度 不错 流畅 早餐 品种 太 少 有现 煮 面条 米线 油条 难吃 送 水果 床 很大 舒服,1
不错 北京 首选 餐厅 太贵,1
