review,label
距离 川沙 公路 较近 公交 指示 蔡陆线 麻烦 建议 路线 房间 较为简单,1
商务 大床 房 房间 很大 床有 M 宽 整体 感觉 经济 实惠 不错,1
早餐 太 差 不加 食品 酒店 重视 房间,1
宾馆 街道 不大好 找 还好 北京 热心 同胞 宾馆 设施 介绍 房间 很小 确实 低价位 因素 无超 所值 环境 不错 胡同 安静 整洁 暖气 好足 一大 优势 是从 宾馆 出发 步行 不到 十分钟 梅兰芳 故居 京味 胡同 北海 距离 好近 不错 推荐 节约 消费 自助游 朋友 划算 特色小吃,1
CBD 中心 没什么 店铺 说星 勉强 卫生间 电吹风,1
酒店 配 价格 算 希望 装修 客人 留些 印象,1
价格比 不错 酒店 免费 升级 感谢 前台 服务员 房子 还好 地毯 新 上次 好些 早餐 早,1
不错 同等 档次 酒店 中 值得 推荐,1
入住 丽晶 感觉 新 酒店 淡淡的 油漆味 房间内 新 房间 大小 合适 卫生间 设备齐全 服务态度 网速 提升 感觉 还好 免费 插 线板 水果刀 一系列 日常用品 免费 提供 细心 晚上 自助餐 每人 菜品 酒店 外有 西贝筱面 几家 饭馆 西贝 菜 实在 量 惊人 人多 酒店 吃 西贝 吃 酒店 点有 广式 晚 茶 吃 几次 味道 正宗 点心 品种 略少哈 酒店 地处 青山区 包头 分昆区 青山区 相对来说 昆区 繁华 青山区 次之 包百等 商场 全在 昆区 酒店 打车 包百 商圈 车费 元多 青山区 王府井 百货 相对来说 包百 商圈 酒店 打车 元多 银河 广场 酒店 一段距离 打车 银河 广场 边上 科丽珑 小时 营业 超市 酒店 一楼 小卖部 超市 住 正赶上 几家 公司 开会 楼道 里略 吵 晚上 几次 有人 敲 错门 理论 酒店 管理 没关系 希望 会议 团体 住 一层 也许 好些 总体 感觉 丽晶 包头 还会 住,1
酒店 新 装潢 设施 不错 房间 油漆味 早餐 品种 交通 饭店,1
住 特色 标间 特色 类似 家 感觉 寝具 单调 白色 条纹 格子 感觉 温馨 圈儿 椅 靠垫 卡通 加菲猫 头明 黄 颜色 扎眼 配在一起 感觉 协调 客房 硬件 评价 分 加湿器 烫衣 板 电熨斗 吹风机 冰箱 俱全 缺点 液晶电视 固定 墙上 位置 不好 一是 遮挡 电源插座 二是 桌子 搭配 不当 桌子 冰箱 柜 一体 电视 下方 坐在 桌子 旁 上网 工作 学习 正好 挡住 电视屏幕 错开 坐 正好 冰箱 柜 腿脚 伸不开,1
早餐 服务 热情 早上 很早 退房 时 前台 值此 人员 办理手续,1
行政 大床 总体 感觉 不错 价格 稍许 高 点 旁边 有个 五星 豪华 客房 估计 小天鹅 房型 住 房间 实在 差 住 选 行政 大床,1
好像 跟洪 崖洞 酒店 公司 房间 风格 接近 整体 不错 房间内 食品 免费 实在 早餐 实在 不敢恭维 大堂 环境 差 整体 不错 三星级 酒店,1
前台 楼层 服务员 不错 房间 安静 整洁 交通 吃 唯一 卫生间 地漏 设计 不好 导致 少量 积水,1
宾馆 总体 感觉 不错 价格 出行 购物 订机票 国航 右边 房间 电脑 免费 上网 地方 补充 点评 年月日 机场 机场 大巴 半个 小时 一趟,1
价格 偏高 服务 窗外 风景 ok 早餐 不错,1
酒店 申定 五星 中 四星 勉强 大堂 气派 细节 粗糙 硬件 服务 人员 礼貌 热情 酒店 房间 早餐 不错,1
闹中取静 地方 窗前 不错 风景 酒店 价格 偏高,1
价格 偏高 连云港 地方 酒店 偏贵 早饭 不好 房间 不错 窗外 风景 还行 房间 窗户 隔音 床小 明珠 万豪 床 好些,1
网线 接口 高家庄 地道口 隐蔽 床头柜 想不道 自带 米 网线 自带 板凳 房间 垃圾桶 翻过来 坐,1
沈阳市政府 酒店 大气 交通 便利 出门 左 北陵 公园 环境,1
政府 酒店 感觉 气派 干净 酒店 房间 布局 整齐 月份 入住 第一天 房间 上网 前台 协调 换 一间 上网 帮忙 调试 笔记本 服务 周到 正好 住 两天 有人 结婚 感觉 酒店 一楼 宴会厅 适合 婚礼,1
总体 前台 服务员 敬业 登记 入住 客人 护照 幸亏 旁边 不知 后果 声 不好意思 对不起 希望 改进,1
月 下旬 丹东 携程网 预定 丹东 国际 酒店 天 住宿 日 傍晚 抵 丹东 打车 酒店 丹东 城市 不大一 国际 酒店 司机 酒店 一条 不起眼 街上 周围环境 总台 一问 接待员 收到 携程 预定 手机 收到 携程 确认 短信 接待员 携程 预定 价住 鸭绿江 房间 接待 查 电脑 房间 点 没关系 反正 人住 安排 层 接待员 真 客人 看江 进 房间 窗外 一看 蜿蜒 鸭绿江 眼前 朝鲜 一侧 房屋 农田 清晰可见 稍 远处 隐约可见 鸭绿江 桥 房间 略显 旧 床 整洁 干净 江景 房 性价比 超值 想当年 国际 酒店 丹东 数一数二 装修 比不上 新开业 大堂 不太 光亮 楼层 电梯 口 开 一小部分 灯光 服务 不错 服务员 客人 问好 特别 值得一提的是 楼 旋转 餐厅 深圳 国贸 上海 新锦江 顶楼 旋转 餐厅 相比 拼 丹东 边境 城里 自助 早餐 丰盛 面对 鸭绿江 饱览 异国风光 农田 沙洲 景色 丹东 国际 酒店 天 停留 留下来 不错 印象,1
北京 北师大 办事 特意 留意 宾馆 住 两天 宾馆 好找 西四 大街 很近 公交车 护国寺 站 步行 两分钟 因离 公交站 近去 坐 公交 省钱 省事 宾馆 外有 小吃店 价位 王府井 小吃街 便宜 护国寺 街上 报刊 厅 毛 一分钟 公用 长途电话 水果摊 小时 便利店 网吧 应有尽有 房间 干净 这方面 北京 住 几个 三星级 这家 二星级 房间 暖气 开得 足够 缺点 冲澡 时 水温 太低 忽冷忽热 原因 卫生间 插座 充电 窗头 柜 插座 只能 电视机 柜后 充电 不太 宾馆 对面 烟酒 店里 烟 假 宾馆 服务员 热情 感觉 推荐,1
房间 设备 太破 喷头 不好 空调 感觉 不到 我开 设备 维修 洗澡 用品 感觉 廉价 货 味道 奇怪 洗头 液 总体 感觉 服务 设备 招待所 水平,1
总体 感觉 不错 美中不足 房 房 之间 隔音 效果 不太好 房价 感觉 稍 高,1
设施 稍 陈旧 服务 温暖 酒店 处 地理位置 环境 极好 年龄 较大 旅游者 入住 酒店 不失为 较佳 选择,1
房间 干净 卫生间 太小 转身 费劲 地理位置 一半 因在 胡同 里 找到 服务,1
总体 满意 一点 需 改进 楼 入住 走时 楼前 台 结帐 时 楼层 服务员 检查 房间 发现 零星 物品 遗失在 房间 请 送 答复 楼 客房 服务部 去取 楼 说服 员员 时间 楼 去取 没什么 东西 送 楼 取到 东西 我会 酒店 更好 印象,1
环境 不错 室内 色调 温馨 MM 满意 窗户 收拾 太 马虎 拉开 窗帘 凌乱 感觉 地方 淋浴 地方 太小 洗澡时 水时 大时 停 几秒,1
年前 住 酒店设施 价格 还算值 黄金周 期间 临海 位置 高层 大部分 房间 海 前台 接待 小姐 态度 生硬 登记 姓名 字 算啦 影响 住 计较,1
西餐厅 晚餐 不错 自助餐 吃 捧 肚子 出门 字棒 早餐 差远 号称 字汗 宾馆 反馈 年月日 尊敬 宾客 您好 感谢您 入住 金陵 溧阳 宾馆 留下 宝贵 意见 早餐 做 调整 努力 进取 发扬 金陵 溧阳 宾馆 以客 尊 服务 理念 一位 宾客 金陵 溧阳 宾馆 留下 美好 深刻 印象 表示感谢 期待 光临 祝您 工作 顺利 身体健康 金陵 溧阳 宾馆 客务 关系 主任,1
早餐 不错 市中心 购物 号楼 房间 相当于 星 标准 房价 值 补充 点评 年月日 房间 提供 拖鞋 太小 穿不下 女士 设计 码 脚 宾馆 反馈 年月日 尊敬 宾客 您好 感谢您 入住 金陵 溧阳 宾馆 感受 意见 告知 提出 拖鞋 太小 下次 入住 金陵 溧阳 宾馆 时 需向 服务员 提出 意见 记录 特别 需求 提供 满意 服务 发扬 金陵 溧阳 宾馆 以客 尊 服务 理念 一位 宾客 金陵 溧阳 宾馆 留下 美好 深刻 印象 表示感谢 期待 光临 祝您 工作 顺利 身体健康 金陵 溧阳 宾馆 客务 关系 主任,1
房间 稍 清洁 实惠 不足之处 双人房 洗澡 用品 一套 宾馆 反馈 年月日 尊敬 宾客 您好 感谢您 选择 入住 金陵 溧阳 宾馆 酒店 双人房 洗漱 用品 一套 召集 酒店 相关 部门 对此 研究 整改 努力 管理 服务 工作 位 进一步 关注 宾客 关注 细节 衷心 感谢 期待 溧阳 并入 住 金陵 溧阳 宾馆 提供 优质服务 机会 顺祝 工作 顺利 身体健康 金陵 溧阳 宾馆 客务 关系 主任,1
人间 暖气 太 暖和 时冷时热 被单 油污 地方 接受 洗漱间 厕所 暖气 洗澡 冷 小时 热水 周到 服务 桶 式 饮用水 不错 周围环境 安静 西到 西直门 动物园 北到 积水潭 新街口 豁口 南到 西单 东到 后海 地理位置 豁口 新开 新华 百货商场 气派 不错 逛逛 推荐 居住,1
酒店 溧阳 公务 旅游 适合 自助 早餐 酒店 内部 环境 服务 唯一 酒店 大门口 晚上 时太乱 车辆 门口 挤成一团 补充 点评 年月日 房间 淋浴 水压 稳 一会 热 一会 冷 不好 调整 宾馆 反馈 年月日 感谢您 选择 入住 金陵 溧阳 宾馆 给予 肯定 赞赏 倍受鼓舞 自信 地去 做好 服务 工作 宾客 给予 鼓励 赞赏 酒店 服务 品质 得以 提升 酒店 大门口 秩序 房间 淋浴 水 做出 措施 衷心 感谢 期待 光临,1
住 号 五星 楼 总体 服务 欠缺 退房 时间 太 长 宾馆 反馈 年月日 感谢您 入住 金陵 溧阳 宾馆 网站 入住 感受 分享 宾馆 始终 致力于 提升 酒店 软件 硬件 设备 客人 提供 入住 环境 美好 入住 体验 意见 做 专题讨论 退房 一系列 服务 做出 改进 恭候 光临,1
预定 床间 大床 米 宽 房间 倒 很大 值得 推荐 自助餐 酒店 客人 元人 不错 餐厅 服务员 见到 笑容 不太 理睬 客人 招呼 不好,1
帮 JJ 好像 不怎么样 水 好像 差点 补充 点评 年月日 我点 分 显示 分,1
位置 不错 市中心 吃饭 房间 一如既往 干净,1
房间 楼下 食街 服务态度 网络 不太好 断线 早餐 一般般,1
不错 酒店 房间 干净 安静 楼 客户 请客 酒店 包房 吃 味道 中式 早餐 略有 没什么 选 味道,1
酒店 设施 稍微 一点 四星级 酒店 附楼 服务 不错 酒店 价格 吸引 下次 还会 入住 补充 点评 年月日 住 不错 冬季 里 没用 霉味,1
住 大床 房以 四星 标准 衡量 家具 太旧 房间 太小 早餐 品种 单一 总体 地段 不错 服务 满好,1
住 住 朝向 大院 房间 酒店 中央空调 设备 晚上 响 影响 休息 早餐 好吃 东西 酒店 旁边 有条 小路 几家 实惠 饭店 私家菜 出差 宜兴 国际饭店 第一 选择,1
服务 热情 交通 便利 下次 北京 选择 这家 酒店,1
入住 前台 POS 机坏 只能 预付 现金 不便 位于 一楼 餐厅 物美价廉 值得 一去,1
房间 清洁 洗手间 装修 早餐 丰盛 豆腐脑 好吃 交通 隔音 邻居 夜里 点多 电视 声音 开 很大 投诉 酒店 服务 人员 隔壁邻居 协商 解决,1
硬件 服务质量 特别 酒店 周围环境 优雅 早餐 不错 下次 入住,1
表面 装修 精致 住 干净 舒服 宜兴 首选 宜兴 宾馆,1
酒店 环境 设施 不错 服务员 拿份 地图 拿来 价格 高 一点 性价比 令人满意,1
自助 早餐 服务 周到 下次 还会 住,1
前台 小姑娘 有意思 入住 熟,1
相当于 五星 服务 好于 四星 早餐 三星 房价 东西 补充 点评 年月日 有个 印度 派头 服务 热情,1
不错 性价比 高 房间内 设施 打电话 送来 电吹风 地图 住 B 区 好像 档次 低 住 房间 半堵 墙 挡住 风景 同事 住 湖面 很漂亮 健身 区 装修 没能 游泳 运动 遗憾 大堂 高档 房间 内饰 朴素 早餐 行 区位 还行 漂亮 团 距离,1
入住 宜兴 宾馆 性价比 高 房间 很大 房 布置 温馨 早餐 品种 太少 服务员 态度,1
月 日 一家人 入住 北京 五日游 门童 柜台 接待 餐厅 服务 卫生 温馨 热情 礼貌 一种 宾至如归 之感 入住 结帐 速度 很快 北京 景点 交通 景点 步行 分钟 到达 有梅,1
家 一贯 风格 房间 如家 价格 实在 上海 住店 干净 价格 优惠 就行了,1
机场 很近 房间 里 床 很大 一面镜子,1
还行 不算 失望 地铁 号线 走 M 中环 旁边 开车,1
携程 上订 入住 两天 酒店 携程 价 加收 房费 免费 升级 商务 房 问 酒店 前台 指甲剪 建议 这类 物品 提供 服务 客人 吃 一顿 自助 早餐 品种 算 牛奶 豆浆 咖啡 总体 感觉 算 酒店 新 干净 隔音 差 吵 酒店 出门 地铁 公交线 公交 直达 上海动物园 酒店 延迟 退房 时间 商量余地 不好玩 宾馆 反馈 年月日 感谢您 酒店 评价 感谢您 提 建议 家 酒店 服务 规范 中 指甲剪 租借 物品 前台 免费 提供 客人 未能 提供 服务 不便 诚恳 致歉 请 原谅 酒店 此类 细节 关注 失望 自助 早餐 品种 Ｂ Ｃ 三套 互换 饮料 中 牛奶 豆浆 咖啡 红茶 橙汁 几种 饮料 互换 夏天 还会 增加 冰冻 冷饮 牛奶 服务生 提出 乐意 为您服务 欢迎您 下次 光临 家 快捷 北虹 路店 感觉 一天天 希望 机会 证明,1
不错 酒店 地铁站 距离 房间 床 很大 舒服 空间 缩小 喜欢 张床 早上 服务员 声音 响 希望 改进,1
超赞 窗正 中环 一点 吵 房间 干净 整齐 舒服 感觉 服务 价格 不贵 满意,1
月 日 家人 泰山 玩 携程 订 华侨 大厦 房间 搞 活动 花 升级 房间 房间 华侨 大厦 评价 网友 评价 服务 热情 设施 太 陈旧 携程网 酒店 反馈 新装修 房间 订房 携程 工作人员 订 房间 是否是 新装修 希望 携程 工作 做 仔细 入住 华侨 大厦 门童 前台 房间 服务 态度 热情 客人 很快 孩子 多送 一套 洗漱 用品 房间 放下 电话 没多久 服务员 送来 询问 泰山 玩 好吃 耐心 回答 房间 果盘 分量 不小 实在 华侨 大厦 设施 确实 太 陈旧 地方 墙纸 脱落 房间 浴室 独立 淋浴间 感觉 老人 小孩 时 服务 弥补 价钱 不贵 感觉 接受,1
大堂 不错 四星 样子 房间 设施 感觉 旧 卫生间 细节 不错 配套 东西 不错 感觉 机会 泰山 入住,1
装修 旧 特别 地毯 材质 颜色 显得 较脏 四星 评级 不相称 门童 热情 赞,1
住 这家 酒店 上次 来到 前台 服务员 准确 报出 名字 感觉 亲切 四星级 当天 服务员 还给 安排 一间 商务 单间 房间 新 我订 价格 没变 酒店 搞 活动 商务 客人 机会 享受 不错,1
不错 酒店 依山傍水 大片 森林 散散步 不错 坐在 湖边 休息 不错 选择 房间 幽静 房间 设施 服务员 态度,1
不知 怎么回事 想 泰安 华侨 大厦 点评 未 成功 酒店 服务 前 一段时间 同事 泰安 爬 泰山 晚上 点 出发 前台 服务员 告诉 山上 气温 低 多加件 衣服 细心 凌晨 退房 走 急 钱包 落 床 山脚 时 酒店 服务 人员 打电话 捡 钱包 这才 发现 钱包 丢 回到 酒店 记得 那位 值班人员 苏秀 表示感谢 谢谢 宾馆 反馈 年月日 酒店 老牌 四星级 酒店 员工素质 高 个个 十几年 服务 经验 对客 服务 泰城 数首 屈一值 宾客 选择 酒店 会住 温馨 安心 放心,1
月 日 入住 华侨 大厦 来时 车上 受 点 风寒 入住 登记 时 不住 打喷嚏 总台 服务员 关切 询问 感冒 感动 刚进 房间 客房 服务员 送来 一碗 热腾腾 红糖 姜水 人性化 服务 真的 感到 温暖 不愧为 泰安市 唯一 一家 四星级 酒店 酒店 岱庙 步行 五分钟 距离 金钥匙 服务中心 赠送 市区 图 泰山 地图 酒店 服务 先于 客人 开口 酒店 金钥匙 租车 订票 回到 家 第二天 意外 收到 问候 短信 非常高兴 选择 泰山 华侨 大厦 约定 年 春天 朋友 重游 泰山,1
不错 酒店 房间 较大 舒适 住 层 安静 楼 餐厅 菜肴 价廉物美 品种 桐乡 酒店,1
桐乡 不错 选择 大堂 很大 打车,1
性价比 高 硬件 设施 改善 满意,1
住 豪华 大床 房 硬件 不错 可惜 床单 细小 毛发 服务台 获知 换 自助餐 桐乡 酒店,1
性价比 高 一家 满意 家门口 便利 水果店 离久光 百货 分钟 步行 离号线 静安寺 分钟 步行 酒店 服务 到位 表扬 房间 叫餐 味道 足量 足 价格 平民 我会 选择 记得 早点 预定,1
商务 标间 房间 洗手间 很小 隔音 效果 不太好 总体 算 干净 整洁 交通 静安寺 很近,1
房间 太小 格林豪 泰 会员卡 房间 携程 房间 五楼 一间 房 好像 房间 很大 床 超大 比米 希望 携程 提供 房间,1
位置 闹中取静 交通 便利 门前 小型 超市 东西 一应俱全 老鸭 粉丝 小吃 酒店 餐厅 伙食 不错 步行 离久光 分钟 路程 南京 西路 大型 购物 商场 恒龙 广场 梅龙镇 中信 泰富 分钟 淮海路 平行 上街 购物 超级 棒 房间 我住 豪华 双人间 环境 不错 干净 卫生 小时 热水 冷暖空调 杂志 供 阅读 唯一 美中不足 电视 服务态度 不错 反馈 客人 下次 住,1
订 标准间 免费 升级 行政 间 不错 酒店 环境 不错 服务 酒店 门口 停车场 收费 感觉 不好 第一次 碰到 状况 希望 下次 住店 客人 免费 原因 是因为 五星级 酒店 自然 五星级 服务,1
安静 周围环境 不错 交通 便捷 娱乐 设施 饮食 之处,1
房间 旧 住 房间 打扫 前台 服务员 协同 不好 补充 点评 年月日 这家 酒店 服务 从前 设施 旧 不住,1
这家 酒店 位置 房间 性价比 不错 不知 客人 服务 自然 下降 携程 客人 不太 受欢迎 每次 入住 订 床间 房间 打扫 积 会员卡 分 前台 补充 点评 年月日 这家 酒店 服务 越来越 差 酒店设施 旧 从前 不住,1
携程 不错 订 行政 房给 免费 升级 号 楼 山景 房 酒店 超星 环境 星 房间 星 设施 服务 酒店 分栋 依山 而建 酒店 里 散步 路线图 酒店 山景 从容 走 至少 小时 期间 山水 桥路 鸟叫 虫鸣 空气清新 心旷神怡 号楼 酒店 一栋 楼 价格 贵 房间 房间 宽大 落地窗 外 山景 翠色 其大床 一看 知 舒服 床 低 床垫 质量 不好 床上用品 干净 成色 旧 灰扑扑 颜色 摸上去 硬邦邦的 家具 电器 卫生间 用品 一位 早餐 品种 吃饱 精致 美味 谈不上 各处 服务员 态度 服务 意识 服务质量 应 提高 酒店 宽阔 停车场 住店 客人 收费 宾馆 反馈 年月日 您好 感谢您 对红 珠山 宾馆 提出 宝贵意见 宾馆 现 将布草 更换 意见 交给 相关 部门 诚恳 期待 下次 光临,1
呼市 出差 入住 金辉 酒店 酒店 房间 设施 相关 条件 房价 中算 不错 服务员 态度 估计 工行 下属 关系 酒店 里 乱七八糟 骚扰电话 满意 酒店 地理位置 极佳 餐饮 购物 银行 景点 全离 下次 呼市 还会 选择 补充 点评 年月日 金辉 酒店 自助餐 一位 菜品 冷热 主食 感觉 价格 全理 酒店 楼 餐厅 点菜 位 用餐 选择 点菜 菜价 不算 贵菜量 服气,1
酒店 承诺 接机 飞机 本来 晚上 稍晚 加取 行李 分才 酒店 服务生 出口 举牌 热心 态度 送 回 酒店 感谢 酒店 市中心 机场 市区 蛮远 酒店 接机 真的 酒店 楼 高 想象 价格合理 干净 官方 评级 不错 星 补充 点评 年月日 多月 想 酒店 不错 机会 HHHT 肯定 还会 住,1
住 两次 比较满意 特别 接机 服务 接 周到 宽带 速度 免费 果盘,1
酒店 位置 火车站 很近 走路 分钟 不到 服务 不错 送果 篮 水果 烂烂 送 送 一点 干脆 就别 送 酒店 整体 不错 房间,1
价廉物美 选择 晚上 机住 合适 服务 热情 房间 地毯 清爽 海景 好看,1
星 标准 干净 宽敞 忍受 度假区 吃 自助 海鲜 晚餐 苍蝇 包围 眼看 食物 上落 苍蝇 花 钱落 一肚 火过 道 海滩 美 很静,1
酒店 服务员 态度 晚上 送 两个 玩偶 房间 酒点 自助 早餐 实在 不感 恭维 餐厅 敞开式 空调 喜来登 封闭 空调 餐厅 客人 选择 海风 习习 汗 吃 现烧 米粉 热 受不了 苍蝇 蚊子 苍蝇 食物 飞 停 蚊子 围着 打转 每次 早餐 点现 煮 以超快 速度 吃,1
月 日 月 日 亚太 二期 一共 住 四个 晚上 原本 想 酒店 住 两天 亚龙湾 住 两天 老公 太累 酒店 想想 后悔 亚太 国际会议中心 服务 不错 见到 服务员 主动 客人 打招呼 亲切 三期 中餐厅 收银员 态度 冷淡 宾馆 大堂 漂亮 游泳池 美 事先 再三 住 五楼 海景房 携程 表示感谢 房间 陈旧 讲究 老公 不太 符合 五星级 标准 厕所 兰色 主题 干净 很大 儿子 喜欢 早上 起床 迫不及待 打开 厚厚的 窗帘 第一 感觉 美极了 棒极了 这家 酒店 早饭 一般般 连住 四天 吃 品种 味道 实在 不敢恭维 要命 房间 前台 立式 空调 酒店 地方 空调 吊扇 早上 吃 汗淋淋 热得 实在 吃不消 餐厅 环境 不错 三期 吃饭 感觉 环境 二期 餐厅 中央空调 服务员 热 空调 不开 总的来讲 服务 不错 环境 不错 大海 沙滩 很近 三亚 美的 地方 儿子 走 依依不舍 三亚 热 地方 酒店 空调 太热 下次 冬季 住 季节 再住 酒店 可惜,1
入住 度假区 豪华 海景房 前台 楼 楼 海景 挂牌 星 星 标准 入住 星 喜来登 差 整体 符合 他家 价钱,1
酒店 设施 环境 不错 集市 超市 房间 阳台 一望无际 大海 真的 心情 不错 唯一 早餐 东西 机场 市区 太远元 搞定,1
酒店 棒 环境 一流 太美 空气 绿化 人流量 温泉 机会 携程 努力 安排 事,1
吸取 网友 经验 预定 度假区 高层 海景 大床 房于 月 日 入住 亚太 服务 不错 安排 房间 服务员 走廊 里 客人 问好 晚上 酒店 吃 烧烤 服务 不错 酒店 环境 海滨浴场 不错 泳池 造型 很美水 清澈 晚上 水池 灯光 很漂亮 淡季 原因 海滨浴场 特别 安静 适合 度假 美中不足 房间 设施 陈旧 电视 太小 风扇 空调 噪音 电话机 老旧 拖鞋 不太 干净 自带 拖鞋 早餐 提出批评 种类 味道 实在 不敢恭维 五星 酒店 房间 设施 陈旧 理解 更新 成本 过高 早餐 质量 改进 星级 相配 北京 五星 酒店 入住 第一天 送 水果 蜈支洲岛 观海 木楼 送 水果 可惜 亚太 客人 一种 服务 建议 亚太 考虑一下 酒店 舒服 留下 印象,1
酒店 设施 服务态度 确实 不错 房间 楼 新装修 楼 房间 成旧 洗澡 单独 整体 浴室 水 空调 风 足 宾馆 好像 海军 南海舰队 地理位置 靠近 省委 火车站 黄兴 步行街 三站 值得 入住,1
地理位置 西湖 边上 大排挡 饮食 酒店 服务 服务生 前台 人员 热情 房间 大而 整洁 价格 性价比 高 下次 西湖 还会 入住,1
入住 港澳 身份证 预订 登记 安排 楼层 高 区别 房间 新 改造 行李 员 态度 不错 下午茶 款式 入住 送 五十元 代金券 算下来 房间 价格 划算 下午 再来 入住,1
意外 入住 时 早餐券 一张 餐券 自助 早餐 中午 旋转 餐厅 行政 套餐 还余 块钱 可惜 不退 不错 酒店 包 两餐,1
住 行政 房是 全新 五星级 标准 v 可惜 楼顶 中餐厅 停业 装修 喜欢 餐厅 正宗 广东菜 希望 下次 来时 复业 酒店 花 精力 装修 更新,1
一年 没来 住 感觉 不错 旧 瓶装 新 酒 标准 房 设施 换 新 见到 笑脸 买方市场 喜欢 员工 巴结 客人 感觉 满分,1
行政 间 想 大床 行政 房 区别 发现 房间 不错 床 很大 服务态度 不错 门口 换 女 门童 笑容 不错 前台 接待 礼宾 部 服务 不错,1
总体 感觉 不错 位置 中心 商业区 上次 晚到 提供 升房 客房 协调 升上去 一间 房 行李 内部 沟通 时间 早 晚 当事人 总会 舒服 地方,1
标准 商务酒店 优点 位置 房间 干净 设施 还行 细节 改进 楼层 服务员 不错 上次 住 楼 表扬 这位 服务员 收拾 房间 做 清洁 走 东西 忘 追 好长 一段距离 告诉 浦东 大道 修路 附件 象个 打工,1
环境 不错 淡季 携程 价格 诱惑力 过程 中 携程 一点 影响力 反复 督促 圆满 解决 表扬 五星级 确实 不错 温泉 值得 一泡 置身于 森林 中 面向 翠湖 细雨 纷纷 热腾腾 汤池 享受 内陆 城市 消费 水准 低于 沿海 城市 酒店 服务 意识 不错 性价比 高,1
超值 一家 酒店 豪华 享受 这家 酒店 一部分 令人满意 AvlNtTy,1
帮 同事 订 酒店 老兄 东莞 回来 详细 地问 粤海 酒店 印象 硬件 软件 极好 表扬,1
酒店 服务 意识 热情 主动 介绍 酒店 特色 感觉 不错,1
酒店客房 绕 池塘 建池 中 金鱼 频添 几分 情趣 主 客房 餐厅 池塘 相隔 安静 优雅 两 停车场 接客 送客 不足之处 特价 房 电器 旧,1
环境 确实 不错 吃喝玩乐 一应俱全 足不出户 享受 周边环境 太 差 酒店 没什么 看头 日本 人多 日本 股份 房间 日文 一层楼 日式 做 房间 房是 TATAMI 式 吃 西餐 粤菜 价钱 便宜 服务 性价比 高 值得 推荐,1
酒店 环境 不错 楼台 庭阁 安静 感觉 住 园林 游泳池 免费 开放 惊喜 可惜 没带 泳衣 房间 没什么 感觉 服务 不错 服务生 帮忙 行李 房间 小费 公司 安排 出差 酒店 回到 广州 发现 忘记 发票 打电话 酒店 酒店 同意 寄过来 付 感激 电梯 楼 很矮 好像 层 外面 环境 周边 比较落后 距离 镇 中心 分钟 车程,1
住 感觉 不错 宽带 速度 很快 服务态度 价钱 酒店 周围环境 不好 日本 实在 太,1
房比 但服 值得一提 西餐 食物 城 排 首位,1
