review,label
楼层 酒店 功能设计 服务 感到 标准 培训 改进 房间 不错 干净 进门 感到 排斥 睡 房间 配有 沙发 不间断 电源插座 自贡 简图 第一次 自贡 旅客 电视频道 中有 HBO,1
酒店 修路 出行 痛苦 服务 一如既往 趟 健身房 好小叻 设备 挤 不错 BTW 餐厅 金银 卡 打折 yo,1
前台 服务 不好 位置 算 房间 感觉 没好 干净 早餐 品种 太 少 可贵 飘柔 舒服 佳,1
雄飞 假日酒店 位置 灯会 彩灯 公园 挺近 房间 窗户 一条 河 江 舒服 房间 设施 比较满意 四星级 标准 感觉 一点点 差距 房价 前台 价是 携程 不错,1
酒店 单人 房间 很大 一室 一厅 装修 旧 算 不错 早餐 西式 氛围 前台 服务 稍差 办理 入住 时 白胡 一点 专业,1
机场 很近 分钟 不到 块钱 市区 实在 太远 有段 路 荒凉 旁边 有个 易 初莲花 明珠 广场 环境 不错 房间 行 携程 价格 竞争力 朋友 入住 房价 朋友 公司 预定 房价 仅为,1
公寓 不错 房间 舒服 布置 价格 高,1
第二次 帮别人 预定 酒店 第一 有订 不错 下次 住 住 试试,1
京广 环境 客人 喜欢 服务水平 欠缺 打电话 前台 客人 留言 那位 太忙 留言 酒店 忙 留言 服务 自动 取消,1
入住 海悦湾 酒店 感觉 不错 住 豪华 蜜月 房 房间 布置 温馨 浪漫 开心 惊喜 房间 新 干净 服务 服务 人员 赶来 早餐 楼 咖啡厅 看海 吃 住 价格 感觉 酒店 贴心 服务 感觉 物有所值,1
总 感觉 服务 条件 不错 次日 早退 房时 开票 电脑 故障 急 走 开票 总台 开后 寄回 留 地址 几天 没到 不知 寄出 希望 携程 催 报销,1
沟口 窗口 进沟 人流 房间 行 我要 存包 服务员 不太,1
酒店 环境 服务 机会 住,1
酒店 位置 闹市区 稍微 闹 点 房价 不错 繁简 好像 新装修 值得 推荐,1
交通 便利 房间 干净 装修 风格 喜欢 酒店 周边环境 市中心 一点 做 太 服务态度 不错 酒店 餐厅 下次 机会 吃 中元 炒 米粉,1
服务 人员 态度 房间 干净 网络 速度 不到 四星 酒店 物有所值 骚扰电话 值得 推荐,1
酒店 环境 周边 修路 缘故 进出 市区 堵 厉害 房间内 设施 不错 细节 维护 提高,1
酒店 市中心区 旁边 几个 百货商场 坐车 公车 酒店 门口 站 打车 司机 讲价 不好 海口 出租车 管理混乱 讲价 现象 表表 跳得 飞快 怀疑 改装 建议 先 询问 酒店 工作人员 景点 钱 住 标准 双人间 房间 设备 齐全 景观 楼景 晚上 十点 安静 房间 隔音 好像 较差 晚上 睡觉时 听到 走廊 发酒疯 旅客 大声 喧闹 房间内 预防 艾滋病 宣传单,1
浴室 间 淋浴 浴缸 二种 可依 所好 希望 预订 再用 信用卡 做 担保 房间 紧张,1
服务 不错 性价比 娱乐 项目 房间,1
环境 不错 价格 贵 点 服务态度 满意,1
过分 停车 要块 搞 一下子 性价比 低,1
好像 早饭 品种 少 煎蛋 星级 酒店 里 碰见 房间 异味 打扫,1
卧室 客厅 没什么 影响 客厅 面积 不错 总体 感觉 不错 服务 职业 住 楼层 高 接近 顶层 晚上 吵 低 楼层 情况 卫生间 厨房 面积 不小 设施 算 齐备 可惜 用不上 房间 酒店 服务 满意,1
酒店 服务 不错 房间 干净 提出 上网 换 上网 房间 上网费 收 交通 门口 大连 火车站 原本 吵 住 楼 听 不到 声音 费用 多元 感到 很值,1
酒店 房间 挺大 设施 市中心 很近 checkin 速度 挺慢 改进,1
酒店 环境 不错 房间 感觉 在家 百多 价格 感觉 下次 还会 选择,1
每次 男朋友 住 常住 客人 优惠 情人节 套餐 感觉 不错 前台 服务 友好 地理位置 房间 专注 商务 服务 价格 太贵 一张 黑白 打印 十块钱 太 不可思议,1
酒店 整体 环境 感觉 不错 服务态度 卧室 太小 房间内 两个 床 挨 太近 滚 一块 外 整体 感觉 不错,1
房间 很大 干净 拉开 窗帘 无敌 海景 令人 惬意 间 酒店 闸 坡 算是 一间 不错 酒店,1
酒店 确实 大角湾 酒店设施 算 刚刚 四星 标准 服务 名不符实 三星 指 服务 提供 提供 服务 倒 不错 满意 沙滩 卖点 酒店 沙滩 酒店 印象 大打折扣,1
不错 一家 酒店 房间 卫生间 床 少见 喜欢 下次 上海 回选 这家,1
酒店 价格 越来越 贵 宽带 收费 不错 酒店 装修 闹 晚上,1
沪 出差 目的地 开发区 选择 海悦 地处 开发区 感觉 偏僻 点 打车 安静 酒店 外观 实在 门童 态度 大厅 干净 整洁 BOOKING 时间 短 前台 MM 服务态度 感觉 不错 楼层 装潢 舒服 路上 碰到 酒店 服务 人员 问好 感觉 软件 服务 不错 房间 硕大 双人床 实在 印象 深刻 卫浴 系统 不错 硬件 房间 异味 总体 感觉 上海 住 这家 星 外表 四星 硬件 五星 服务 补充 点评 年月日 忘记 身份证 临走 遗留 酒店 前台 小姐 携程 提醒 感觉 满意 每次 出门 门童 服务 找 取款机 热情 帮忙 实在 不错,1
海悦 总体 服务质量 下降 几个 地方 一层 bar 蛋糕 咖啡 缩水 一年 前 口感 大小 很大 下降 我订 行政 大床 房 感觉 大床 房 区别 价格 还贵 行李房 寄存 行李 一会儿,1
协程 早餐 要元 上次 日期 预定 弄错 酒店 发现 总台 按协程 价格 入住 早餐 补充 点评 年月日 入住 房间 早餐 程 酒店 解是 用餐 前 打招呼 要收 服务费 岂有此理 协程 网上 选择 预定 早餐 协程 预定 酒店 标注 早餐 价格 想 入住 客人 理所当然 会以 价格 为准 酒店 交涉 无果 只能 交钱 走,1
预定 房间 无窗 房间 灯光 亮 好几个 灯 坏 习惯 早上 太暗 建议 预定 入住 酒店 提前 预订 酒店 每层 一间 带窗 预定 号楼 房间,1
总体 算 不错 房间 异味 服务,1
第二次 入住 上海 首选 名气 软硬件 设施 好大床 太 舒服 住 白天 不像 上班 晚上 不想 夜店 想 床上 赖着 推荐,1
说完 人住 不想 外面 吃 来到 中餐厅 怡和 轩 忘记 主攻 粤菜 感动 一塌糊涂 人能 吃 女孩子 难点 菜 服务员 照顾 无微不至 细节 吃 送 下楼 门口 房客 认得 路 美眉 漂亮 温柔体贴 上层 管理 制度 导向 海悦 确实 以人为本 全心全意 客户 着想 星级 多少倍 前两天 锦江 住店 还生 一回 气 物超所值 下次 还来 海悦 谢谢 补充 点评 年月日 地方 偏 门童 负责 帮 车 反正 每次 帮 喜欢 幽静,1
预订 行政 房一厅 建议 性价比 高 酒店 预约 写 到达 时间 酒店 里 写 到达 时间 那天 酒店 时 告知 房间 打扫 郁闷 慢 服务员 倒 主动 对讲机 呼叫 先 打扫 我要 两间 态度 客气 评分 项目 评价 房间 平方米 号称 不算 算是 二房 二厅 二卫 独立 互不 影响 房间 大床 衣橱 厅里 餐桌 茶几 显得 拥挤 开放式 厨房 里 煤气 热水器 微波炉 冰箱 一应俱全 好奇 翻箱倒柜 锅碗瓢盆 不知 下厨 自备 订 两间 大小不等 房型 截然不同 多元 住 两家 人用 四个 字来 形容 ― ― 够 大够 值 环境 这倒 点评 装修 损耗 旧旧 家 想 装修 大堂 电梯 走廊 反正 旧旧 四个 字来 形容 ― ― 简单 服务 前台 小姐 打扫 阿妈 接触 前台 态度 两间房 中 一间 先 打扫 桌子 适合 两个 套间 坐 特地 阿妈 开 一间 拿到 钥匙 房间 情况 换房 阿妈 不情 不愿 样子 耐心 开了门 回答 关门 打扫 打扫 一半 房间 洗澡时 热水器 工作 找 服务生 脸上 始终 笑容 尽职 检查和 试用 主动 提出 房间 少 空调器 事实 告诉 前台 结帐 时 总评 入住 类 酒店,1
住 房一厅 套房 房子 空间 甚大 希望 位置 商业区 不远 吃饭 地方 热水 空调 木地板 价格 满意 蚊子 厉害 第一天 晚上 咬 好几个 包 数天 消退 毒 蚊子 第二天 服务台 电 蚊香 蚊子 咬 服务台 态度 不错 卫生间 水龙头 老化 多年 前 参加 给排水 工程项目 设计 善于 调 水龙头 其他人 困难 携程网 订房 时 告知 每房 提供 免费 软料 瓶 我订 房一厅 提供 免费 软料 瓶 入住 时 服务台 核实 确实 结帐 时 告知 提供 免费 软料 瓶 支付 额外 费用 甚 幽默 感谢 入住 朋友 点评 出租车 司机 不易 找到 酒店 大门 提前 提醒 出租车 司机 顺利 找到 酒店 大门 不错,1
房间 设备 旧 室内空间 宽敞 酒店 购物 逛街 办公,1
月 日 入住 住 一房 朋友 住房 一依算 不房 很大 缺是 停 再就是 水器 置 室然 制排 煤 味道 清 程度 一有免 咖啡 真的 下次 考住,1
很棒 艺术 酒店 日 外出 踏青 一行 入住 珠海 中邦 商务酒店 酒店 开业 几年 住客 感觉 新鲜 评为 中国 首批 艺术 主题 特色 酒店 邦 内刊 业主 计划 扩展 规模 兴建 一座 新 艺术 酒店 年前 建筑 情侣 中路 偶遇 写 一篇 文字 年前 杭州 探访 酒店 设计师 室内 设计师 平面 设计师 舞美 设计师 很棒 新锐 设计 团队,1
好评 入住 确实 特色 宾馆 评上 五星 自有 道理 黑色 主色调 房间 内部 精致 窗比 普同 床 低 半截 舒服 卫生间 淋浴间 设计 巧妙 房间 房门 像是 橱柜 算是 早餐 精致 遗憾 房间 窗户 没同 通风口 商务 建议 入住,1
位置 喜欢 酒店 大堂 房间 设计 美中不足 房间 拥挤 感觉,1
价位 住 房间 惊喜 订 商务 大床 房 夸敞 舒适 房间 靠窗 地方 走进 小小的 书房 不错,1
深圳 住 酒店 交通 便利 外 酒店 整洁 干净 价位 深圳 只能 住 样子 酒店 如果说 唯一 一点 酒店 房间 走廊 开 空调 天热 走进 感觉 闷热,1
不错 住 挺舒服 走 远 截到 的士,1
香港 酒店 位置 偏 前台 服 今次 高房 一入 房 味道 味 有理 肚 吃西 十二 後 野吃 回房 睡 隔音 很差 大清早 房 很大 床,1
住 房间 很大 性价比 高 缺点 常客 习惯 档案 提供 体贴 服务 房间 地毯 清洁 差 电视 选台 太少 房间 一份 楼下 澳葡街 菜牌 客人 酒店 卖点 比较满意,1
入住 商务 房 感觉 挺不错 空调 打开 好像 打开 空调 还好 入住 那天 天气 不错 开窗 感觉 房间 洗手间 玻璃 透明 有人 感觉 尴尬 吃饭 地方 逛街 地方 酒店 附件 太 繁华,1
房间 面积 蛮大 住 房 洗手间 设施 稍显 陈旧 干净 商务 房是 装修 不错 网络 稳定 插头 地方 松 稳定 下载速度 超级 快爽 早餐 中规中矩 还行 马路 房间 入住 情况 不靠 马路 安静 订 火车票 手续费收 高,1
酒店 总体 不错 行政 套房 宽敞明亮 面向 大海 房间 设施 新 距离 海边 肯定 米 不算 太远 步行 五六分钟 硬件 不错 服务 感觉 稍差 前台 两张 大床 套房 出行 前 几次 电话 确认 可到 房间 发现 一张 床 住 四个 前台 协商 告之 房间 全满 标间 可据 大堂 餐厅 水疗 观察 入住率 肯定 连续 三天 水疗 每次 两三个 办法 加 两张床 舒服 门童 不错 开门 行李 记 出租车 牌号 楼层 服务员 稍差 第二天 下午 两点 回来 打扫 房间 自助餐厅 贵元人 吃 东西 当天 三文鱼 限量 个人感觉 不值 游泳池 水太凉 下不去 老公 平时 游泳 游米 连米 没游 冻 怀疑 酒店 想 不想 人来游 硬件 够星 软件 星,1
环境 不错 离石 老人 海滨浴场 很近 房间 不错 吵离 马路 大清早 车 声 想 晚起 一会 不行,1
酒店 处于 石老人 海水浴场 优美 好像 年 开张 新 早餐 自助 晚餐 火锅 一大 惊喜 酱料 齐全 麻酱 两种 辣酱 蒜末 价钱 稍微 贵 健身房 失修 泳池 水疗 中心 住客 免费 令人 享受 行政 套房 宽带 台式 电脑 浴缸 很漂亮 房里 设备 精致 Cable StarMovies 爱 HBO AXN 可惜 服务 随要 随送,1
补充 大堂 服务 人员 太 少 感觉 不太像 四星级 酒店 早餐 一位 搞错 记得 午餐,1
国外 客户 预订 三个 房间 客人 住 酒店 酒店设施 层次 提高 提出 服务水平 一年 评定 硬件 星 服务 星,1
朝南 豪华 房 看海 房间 干净 设施 不错 两个 转不开身 网速 前台 接待 业务 不精 入住 离开 时 前台 出错 服务水平 有待 提高 自助餐厅 一客 价格 低 周边环境 不错 选择 住 海边 很近 啤酒 城 两条 街 距离 吃饭 云霄 路 开车 网友 所说 自驾游 推荐 入住,1
环境 舒适 服务 细致 价格 适中 独特 三项 超人 之处 一是 免费 接机 二是 盒装 品牌 牛奶 赠送 不像 酒店 奶粉 冲泡 市内电话 拨 一名 消费者 角度 借此机会 谢谢 玺 酒店 优质服务 祝 玺 酒店 越办 越,1
酒店设计 特色 房间 舒服 美 位置 南门 出入 免费 上网 前台 服务员 不错 唯 退房 时出 点 令 大打折扣 事缘 饮用 酒店 雪柜 汽水 临退 房前 回 饮品 放进去 酒店 汽水 包装 收 钱 最终 查房 收钱 回 汽水 花 二十分钟 刚刚 赶车 气愤 一共 住 天花 千多元 几元 收足 讨厌,1
入住 酒店 很值 只能 概括性 评价 温馨 舒适 特色 服务 得体 到位 挂牌 四星级 酒店,1
丽江 住此 酒店 不错 整体 环境 交通 便利 性价比 适中 物以 所值 无论是 公费 商务 自助 旅游 建议 丽江 朋友 选择 酒店 补充 点评 年月日 风格 别致 院落 安静 不像 酒店 大院 噪声 很大,1
原本 丽江 旅行社 订房 香格里拉 大道 酒店 到达 酒店 酒店 甚 满意 出租车 司机 推荐 古城 里 丽王 酒店 王府 饭店 玺 酒店 三家 酒店 玺 酒店 古朴 特色 一个个 院落 鸟语花香 令人 陶醉 两个 酒店 大院 房间 较差 遗憾 总 咨询 房价 折扣 元标 服务员 专业 服务态度 推荐 携程网 预订 价格 元标 免费 提供 大堂 电脑 预订 住 号院 安静 傍晚 清晨 花 香味 鸟叫声 酒店 播放 古筝 音乐 丽江 碧空 万里无云 一幅 美妙 立休 画景 有生以来 第一次 享受 如诗如画 场景 来丽 听说 丽江 好多 酒店 同比 城市 酒店 弱 差 住 这家 酒店 真让人 耳目一新 独特 风格 小院 礼貌 热情 服务员 不错 酒店 特色 环境 舒适 服务 一流 漫步 院落 中 服务员 微笑 招呼 置身 大院里 亲人 特向 丽江 朋友 推荐 酒店 感觉 不错 二层 小楼 干净 设施 齐全 比有 五星 感觉 酒店 保安 随处可见 安全感 酒店 古城 里 环境 位置 不错 硬件 条件 纳西族 院落 特色 值得 一住 酒店 全是 木质 结构 建筑 很漂亮 干净 清爽 服务 人员 院落 保安 亭 总台 个个 人性化 服务 唯一 餐厅 可惜 有事 香格里拉 真 不想 离开 想 住 真 休闲 早餐 国际标准 am 客房 电视 外语 频道 涉及 较少 订 房时 网上 酒店 早餐 很次 用餐 早餐 种类 全真 营养 大餐 特别 牛奶 原汁原味 奶粉 冲泡 跟本 网上 所说 不知 酒店 早餐 改进,1
房间 设施 不错 建筑 风格 大厅 稍 想 感受 古城 气氛 应住 四方街 宾馆 瑞和园 不错,1
服务 态度 感觉 舒服 房间 窗子 隔音 不好 外面 噪音 影响 敏感 位置 不错 百米 处 包河 门前 交通 火车站 飞机场 不算 远 早餐 午 晚餐 未 品尝 出门 右边 不远 一条街 特色 饭店 还会 入住,1
丽江 回来 酒店 住 三个 晚上 不错 酒店 机会 丽江 想 选择 入住 酒店 酒店 免费 接机 服务 可惜 一行 八人 是从 香格里拉 乘坐 巴士 丽江 享受 接机 服务 酒店 热情 地派 服务生 下车 地方 接进 酒店 酒店 房间 不错 洗手间 干净 宽敞 免费 赠送 水果 牛奶 贴心 提 一点 酒店 房间 里 提供 一本 丽江 柔软 时光 供 游客 免费 阅读 听 同伴 房间 里 备有 圣经 我常 出差 在外 住 酒店 数不胜数 提供 圣经 酒店 头一回 酒店 确实 贴心 可惜 信奉 佛教 提供 宗教 书籍 更好 酒店 院子 喜欢 地方 同伴 院子 里 拍 好多 照片 漂亮 院子 适合 坐在 慵懒 发呆 一点 酒店 早餐 早上 开放 下午 酒店 露天 位置 晒 太阳 懒懒 享受 美食 意 唯一 不好 一点 茶室 收费 有天 晚上 想 院子 里 泡茶 聊天 想 找 酒店 茶艺居 借用 一套 茶具 福建 游客 随身 铁观音 酒店 却告 借用 茶具 提供 茶叶 泡 每泡 泡茶 收取 手工费 差点 晕菜 茶 兴大 起泡 泡泡 手工费 够 住 两晚 酒店 希望 酒店 稍微 改进 酒店 印象 不错,1
说实话 官房 房间 不错 卫生间 有个 玻璃窗 打不开 感觉,1
纳西 风格 酒店 感觉 第二次 住 这间 酒店 北门 远要 走路 南门 住宿 安静 北门 夜市 开 太晚 想 难 入睡 贵宾 房间 很大 安静 吃 东西 烧烤 酒吧 ok 下次 选择,1
不错 一家 酒店 服务 人员 礼貌 住 二楼 木质 结构 算是 安静 早餐 品种 胜 时间 较长 性价比 高,1
商务 间 间 区别 台 电脑 自带 电脑 商务 旅客 加元 合肥 出租车 态度 很差 是因为 城市 出租车 少,1
携程 豪华 房去 丽江 升级 贵宾房 不错 酒店 服务 人员 礼貌 前台 入住 退房 很快 贵宾房 很大 舒服 特别 厕所 晒 阳光 入浴 感觉 特别 舒服 晚上 冷 贵宾房 窗户 靠着 街上 早晚 行人 街上 吵,1
丽江 回来 感觉 酒店 不错 服务员 热情周到 水果 矿泉水 赠送 早餐 唯一 一点 房间 隔音 楼上 有人 走路 房间 响 睡得 一点 不香 好像 酒店 木制 结构 估计,1
王府 值得 推荐 酒店 保安 饭店 员工 服务态度 宾客 礼貌 免费送 机等 项目 自助 早餐 开到 下午 一点半 免费 水果 热 牛奶 送上 房间 超大 卫生间 超大 床 超大 干净 补充 点评 年月日 年月日 王府 住 晚上,1
月 日 王府 饭店 连住 晚 王府 丽江 古城 饭店 保安 饭店 员工 服务态度 宾客 礼貌 饭店 设施 齐全 宽带 上网 速度 很快 特别 贵宾房 卫生间 设计 舒适 大方 躺 浴缸 里 透过 玻璃 天窗 晒太阳 特 美的 享受 丽江 建议 住 古城 既想 享受 纳西族 优美 古建筑 庭院 家庭 风格 舒适 非 王府 饭店 莫属 原先 官房 花园别墅 朋友 建议 住 古城 里 旅行 明智 选择 饭店 管理层 海龟 背景 张 总 挂帅 大堂 茶 中外 客人 聊天 互动 找到 帮 解决 饭店 氛围 轻松 友好 早餐 喜欢 口味 爱好 英国 回来 一碗 米粉 羡慕 不行 值得一提的是 这家 饭店 自助 早餐 开到 下午 一点半 中国 绝无仅有 适合 懒人 早餐 煮 咖啡 不错 房间 里 送 水果 晚上 打电话 热 牛奶 享用 老板 待客 感到 舒服 基督徒 兄弟姐妹 房间 放置 圣经 国内 国际 知名品牌 酒店 外 做 好像 这是 第一家 张 总 体贴 待人 姐妹 下次 丽江 毫无疑问 王府 家外 之家 二楼 房间,1
总体 入住 比较满意 房间 设施 图片 基本一致 卫生间 不错 客栈 院子 感觉 不错 客栈 服务 加以改进 房间 清扫 这方面,1
总体 算 满意 房间 大床 算 干净 床头 装饰 漂亮 卫生间 尚可 提供 接机 服务 车 陈旧 免费 地理位置 束河 古镇 强烈推荐 住 大研 古城 安静 一点 热情 不像 古城 商业 气息 太浓人 古镇 友好 服务 有问必答 缺点 淋浴 水温 根本无法 调 舒适 温度 太冷 太热 地毯 脏 建议 吸尘 干脆 换 木质 地板 性价比 有待 提高,1
房间 舒适 距离 热闹 酒吧 集中区 环境 干净 ＼ 清净 适合 睡大觉 服务 中规中矩 携程 订房 快捷 ＼ 省心 住 时间 有限 两晚 总体 感觉 不错 下次 丽江 下榻 首选 补充 点评 年月日 分 客栈 短时间 希望 客栈 服务 水准 轻易 商业化 潮流 中 走上 质价 不符 路子,1
老婆 这家 客栈 赞不绝口 四星级 房屋 设施 标准 自带 庭院 美丽 酒店 服务员 老板 早饭 好吃 牛奶 馒头 鸡蛋 肉酱 面 真的 有家 感觉 下次 住,1
这家 酒店 满意 朋友 推荐 下订 丽江 束河 吉奥 古 客栈 三天 要说 丽江 出租车 司机 信 当天 飞机 貌似 老实 善良 纳西 出租车 司机 热情 介绍 特色 建议 温暖 问 有没有 订 酒店 订 丽江 束河 束 奥古 客栈 太晚 女孩子 出租车 只能 古镇 门口 进不去 找 一家 条件 价格便宜 酒店 一晕 带到 城边 客栈 热水 服务员 空调 便宜 倒 便宜 出租车 收 当晚 郁闷 中 渡过 第二天 换到 吉奥 古 感觉 享受 纳西 庭院 暖暖的 阳光 享受 酒店 舒适 进门 员工 吃饭 老板娘 招呼 我要 吃 小弟 提 行旅 下午 座 院里 老板娘 喝茶 聊天 免费 这家 酒店 入住 晚 免费 接机 三晚 收元 含 过路费 接机 丽江 城 免费 接 晚上 老板娘 古城 玩 带上 座 车 酒吧街 酒吧 家 原创 民谣 感觉 D 调 只花 听 晚上 歌 晚上 老板娘 回来 走 送 机场 出租车 要元 这家 酒店 感觉 朋友家 补充 点评 年月日 最要 一点 丽江 出租车 司机 推荐 酒店 信 东西 束河 古镇 便宜 这家 客栈 条件 束河 特别 卫生间 唯一 房间 点 客栈 比有 四星 条件 关键 好玩 酒店 生硬 随意 随便 特别 老板娘 那种 边玩 做 心态 真的 丽江,1
地理位置 优越 房间 温馨 服务 不错 商旅 选择,1
入住 酒店 办理手续 时 久 房卡 预定 信息 酒店 前台 电脑 中 查不到 客房 内应 水果 酒店 服务员 半夜 点才 送到 敲门 客房 感觉 不太好,1
一进 房间 满意 豪华 间 英寸 壁挂 电脑 舒服 沙发 卫生间 干净 漂亮 总体 感觉 温馨 刚进 房间 不到 十分钟 服务生 送来 盘子 水果 MM 满意 半夜 三点 服务 确实,1
酒店 位置 佳 市中心 出行 超 楼下 班车 直达 机场 豪商 房间 配 液晶电视 感觉 电脑 免费 上网 周到 一楼 佳宁娜 餐厅 出品 保证 套餐 二十多块 总体 满意,1
这家 酒店 中国银行 另一面 地址 寻 访问 当地人 说不清 问 中国银行 大厦 好找 酒店 早餐 太差 贵,1
海口 广州 椰香 公主 号 暂住 一晚 发现 携程 订房 宾馆 低价位 房间 推荐 回扣 高 当晚 办 入住 手续 时 边上 有人 开房间 前台 价格 打折 携程 低元 一问 知 房间 倒 少 一台 电脑 房间 实惠 携程 便宜 房间 要元 不爽,1
酒店 硬件 倒 不错 商务旅行 合适 前 村后 挨店 补充 点评 年月日 希望 携程 提供 准确 信息 希望 住 酒店 凯莱 工作人员 告诉 五月花 约 距米 实际上 全程 公里 出租车 记程表 显示 数字 酒店 大堂 酒店 大门 超过 米 每次 只能 酒店 出租 凯莱 要元 路上 截车 跳表,1
酒店 大堂 环境 卫生 比较满意 房间 不错 浴缸 老旧 外 提供 免费 国内长途 市内电话 晚上 关 窗户 听到 酒吧 夜总会 音乐 声音 早餐 质量 四星 不符,1
做 一家 高尔夫球会 酒店 勉强 接受 没什么 高球 爱好者 服务 酒店 球场 景观 房 风景 不错 仅此而已,1
住 这间 酒店 公司 合同 酒店 评价 实际上 喜欢 间 酒店 很久 这间 酒店 深圳 两间 指定 酒店 这间 酒店 大堂 有股 霉味 好多 缺点 酒店 大堂 太小 服务 服务员 态度 礼貌 三部 电梯 中 一部 太小 两部 电梯 联动 房间 异常 风景 不好 办法 交通 出租车 酒店 住宅区 里 大堂 旁边 银行 提款机 对面 便利店 酒店 旁边 咖啡 酒吧 间 酒店 极好 极有 推荐 价值 反正 下次 还会 住 补充 点评 年月日 补充 楼下 房间 里 声 空调 声音 我试 空调 管理 睡 太热 房间 声响 影响 睡眠 建议 酒店 恐怖 实际上 真的 不用 害怕 床 舒服 很小 建议 提供 荞麦 枕头 喜欢 那种 软 枕头 睡着 舒服,1
晚上 深圳机场 酒店 半个 小时 块 样子 酒店 CHECKIN 还算快 奇怪 晚上 睡觉 总有 声音 是从 窗户 传来 仔细检查 发现 窗户 关 好好 声音 酒店 洗澡水 很大 很足 点 不错 CTRIP 预定 提前 天 预定 拿到 价格 提前 多天 预定 出发 前查 提前 价格 感觉 上当受骗 感觉 CTRIP 客户 耍手段 香港 九龙 万丽 幸亏 自用 万豪 网上 预定 行政 楼层 CTRIP 万豪 贵多 HKD CTRIP 首选,1
预定 无烟 房到 checkin 时 告知 无烟 房 晚上 点钟 只能 入住 服务 行 时 窗子 总会 发出 卡 卡 声 晚上 特别 单身女人 入住 吓死 餐厅 自助餐 种类 太少,1
价格 越来越 高 周遍 打车 装修 风格 时尚 舒适 服务态度 不错,1
装修 不错 酒店 感觉 大气 电视 越显 小气 房间 总体 入住 舒适 隔音 不错 不像 圣庭苑 酒店 世纪 楼 晚上 睡觉 听到 隔壁 抽水马桶 声音 早餐 品种 一般般,1
房间 卫生 价位 地点 算是 不错 网速 酒店 新 整体 满意,1
每次 深圳 住 花园 格兰 云天 房间 新 硬件 设施 不错 服务 热情 冰箱 里 饮料 免费 发现 收钱 真不知道 赚 十几块 钱 赢得 客户 好感 相比 孰轻孰重 换洗 衣物 留在 竹筐 里 服务员 免费 帮着 洗 扔 洗衣机 里 那种 早餐 种类 略有 减少 价钱 深圳 宾馆 满意 服务 下降 趋势 希望 酒店 重视,1
酒店 位于 深圳,1
酒店 硬件 设施 四星 标准 小时 供应 热水 水量 足 服务 只能 算是 三星 水平 早餐 最多 二星 标准 团队 过多 酒店 晚上 餐厅 提供 点餐 服务 自助餐 地方 HolidayInn 性价比 差远了,1
地理位置 不错 市中心 繁华 地段 天津 街清 泥洼 楼下 不远 有轨电车 住 mini 标间 想像中 大有平 服务 不好 一点 上网 收费 元天 时间 希望 免费 电视 收到 韩日 美港 台 台 清晰,1
